First Phase545728-545719-54884703YESYESYESGerman Federal Ministry for the EnvironmentOn behalf of an organisationGerman Federal Ministry for the EnvironmentYes4Grant ProgrammeGrant programme for combatting Marine Litter from land-based sourcesTECHNOLOGY and PROCESSES: New technical developments/innovation (e.g.,  research and development,  new product design,  new materials,  processes etc.) changes in practice,  operations,  environmental management and planning.New product design, Change in practice, Change in operations, Different environmental management of land based environments, New infrastructureWORKING WITH PEOPLE: Encouraging or enabling others (e.g.,  education,  training,  communication,  awareness raising,  behaviour change programmes)Funding BodyPUBLIC ADMINISTRATION (organisations concerned with government policies and programmes)National ministry/agencyYesReporting is voluntaryYesTransnational India, Viet NamAgricultural land/soils, Entire water catchment, Urban environment, Waste disposal sites, Coastal zoneRaw materials, Design, Production / Manufacture, Use / consumption, Collection / sorting of plastics after use, Management of collected plasticsReducing plastics, Reusing plastic, Recycling plasticsHuman health and wellbeing, Biodiversity, Marine organisms, Ecosystem Services, Food chain, Economics and TradeMacroplastic (large,  more than 20 mm,  e.g. plastic bottles), Microplastics (tiny plastic particles less than 5 mm in diameter,  e.g.,  found in personal care products/synthetic textiles)Bottles, Plastic bags, Food packaging (containers, wrappers etc.), Non-food packaging (containers, wrappers etc.), Smoking related litter (cigarette butts and packets), Fishing related items, Shipping related items, Cups (e.g., disposable coffee cups), Plastic straws, stirrers, cutlery, Sewage-related items (this could include cotton bud sticks, feminine hygiene items and others disposed of via toilets), Natural disaster/hazard related debris Polystyrene itemsMicrobeads used in cosmetics, Microplastics used in other products e.g. paints 

Packaging, Textiles, Transportation, Building, Construction, Demolition Industrial Machinery, Automotive, Electrical and Electronics Agriculture, Fisheries, Aquaculture, Food & Beverages, Personal Healthcare, Medical, Retail, Tourism, Wastewater/Sewage management 5580357USDPublic FinancingContinuous activity more than 3 Years longhttps://www.bmu.de/pressemitteilung/bmu-startet-foerderprogramm-gegen-meeresvermuellung-in-asien-und-afrika/2020-02-06 14:09:42 UTC2020-02-11 16:10:46 UTC
First Phase545728-545719-55139713YESYESYESIUCNOn behalf of an organisationIUCNNo,  I am returning to the survey to report on additional actions/activitiesNational Plastic Pollution Assessments using a Common MethodologyField testing the  UN Envrionment/IUCN Hotspot Methodology in 5 countries in Asia and East AfricaMONITORING and ANALYSIS: Collecting evidence around plastic discharge to the ocean/waterways? (e.g. monitoring,  analysis)OtherNational assessment of plastic leakage and hotspots It is available on requestThe project is in implementation Once collated data will be published and available. In the interim requests can be be made to the focal pointMONITORING and ANALYSIS: Collecting evidence around plastic discharge to the ocean/waterways? (e.g. monitoring,  analysis)ImplementerPUBLIC ADMINISTRATION (organisations concerned with government policies and programmes), PRIVATE SECTOR ORGANISATION (for-profit organisations run by individuals and groups,  free from government ownership)., THIRD SECTOR (e.g. non-governmental and non-profit-making organisations,  including charity groups,  community groups etc).National ministry/agencySmall-medium sized enterpriseNon-governmental organisation, Community based organisationYesThere is a mandatory reporting mechanismYesTransnational Kenya, Mazambique, South Africa, Thailand, Viet NamOtherNational Raw materials, Design, Production / Manufacture, Use / consumption, Collection / sorting of plastics after use, Management of collected plastics, Clean-up of plastic from the environmentReducing plastics, Reusing plastic, Recycling plasticsHuman health and wellbeing, Biodiversity, Marine organisms, Ecosystem Services, Food chain, Economics and Trade 

Macroplastic (large,  more than 20 mm,  e.g. plastic bottles), Microplastics (tiny plastic particles less than 5 mm in diameter,  e.g.,  found in personal care products/synthetic textiles)Bottles, Plastic bags, Food packaging (containers, wrappers etc.), Non-food packaging (containers, wrappers etc.), Smoking related litter (cigarette butts and packets), Fishing related items, Shipping related items, Cups (e.g., disposable coffee cups), Plastic straws, stirrers, cutlery, Sewage-related items (this could include cotton bud sticks, feminine hygiene items and others disposed of via toilets), Natural disaster/hazard related debris Polystyrene itemsMicrobeads used in cosmetics, Microplastics used in other products e.g. paints 

Packaging, Textiles, Transportation, Building, Construction, Demolition Industrial Machinery, Automotive, Electrical and Electronics Agriculture, Fisheries, Aquaculture, Food & Beverages, Personal Healthcare, Medical, Retail, Tourism, Wastewater/Sewage management Public FinancingContinuous activity 1-3 Yearshttps://www.iucn.org/theme/marine-and-polar/our-work/close-plastic-tap-programme/projects2020-02-11 17:34:14 UTC2020-02-11 18:25:49 UTC
First Phase545728-545719-55142662YESYESYESGulf and Caribbean Fisheries InstituteOn behalf of an organisationGulf and Caribbean Fisheries InstituteYes4Investigating the Link Between Marine Litter and Mosquito-borne DiseasesThis study mapped the incidence of mosquito borne public health concerns in the Caribbean to compare this with plastics consumption and to put the findings into the context of the zika virus. Puerto Rico was used to examine this relationship because the marine litter data was extensive and robust. By overlaying GIS data the study was able to investigate potential correlations and analyse various environmental,  health,  and demographic data to evaluate issues of poverty and gender as they may be related to incidence of disease and risk. This study revealed that there was a relationship between the cases of ZikV and marine debris density,  especially of large marine debris (i.e. tires). These results also suggest that coastal communities may want to prioritize the clean up of large marine debris to limit the habitat for Aedes aegypti habitat and subsequent ZikV transmissionMONITORING and ANALYSIS: Collecting evidence around plastic discharge to the ocean/waterways? (e.g. monitoring,  analysis)Monitoring: On the shoreline, OtherIncidence of ZikVWe used data from the ICCIt is not availableMONITORING and ANALYSIS: Collecting evidence around plastic discharge to the ocean/waterways? (e.g. monitoring,  analysis)SubmitterOtherThere is no implementationYesReporting is voluntaryOtherThe report was publishedSub-national Puerto Rico (USA)Puerto Rico (USA)Mountains and upland area, Agricultural land/soils, Entire water catchment, Forests or Mangroves, Freshwater rivers and lakes, Urban environment, Waste disposal sites, Coastal zoneClean-up of plastic from the environmentNot ApplicableHuman health and wellbeingMacroplastic (large,  more than 20 mm,  e.g. plastic bottles)Bottles, Plastic bags, Food packaging (containers, wrappers etc.), Non-food packaging (containers, wrappers etc.), Smoking related litter (cigarette butts and packets), Fishing related items, Shipping related items, Cups (e.g., disposable coffee cups), Plastic straws, stirrers, cutlery, Sewage-related items (this could include cotton bud sticks, feminine hygiene items and others disposed of via toilets), Natural disaster/hazard related debris Polystyrene itemsPackaging, Textiles, Transportation, Building, Construction, Demolition Industrial Machinery, Automotive, Electrical and Electronics Agriculture, Fisheries, Aquaculture, Food & Beverages, Personal Healthcare, Medical, Retail, Tourism, Wastewater/Sewage management 5000USD3000USDPrivate SectorGCFI in kindSingle event2020-02-11 18:20:36 UTC2020-02-11 18:43:19 UTC
First Phase545728-545719-55142943YESYESYESIUCNOn behalf of an organisationIUCNNo,  I am returning to the survey to report on additional actions/activitiesLocal and Regional Capacity Building to Facilitate National Action to Control Plastic PollutionCircular economy demonstration projects in 5 countries implemented.  Learning captured and scaled up WORKING WITH PEOPLE: Encouraging or enabling others (e.g.,  education,  training,  communication,  awareness raising,  behaviour change programmesAwareness raising and Behaviour change, OtherSupport of promotion of circular economy initiatives through a grant programCommunity Engagement, Stakeholder EngagementWORKING WITH PEOPLE: Encouraging or enabling others (e.g.,  education,  training,  communication,  awareness raising,  behaviour change programmes), TECHNOLOGY and PROCESSES: New technical developments/innovation (e.g.,  research and development,  new product design,  new materials,  processes etc.),  changes in practice,  operations,  environmental management and planningImplementerPUBLIC ADMINISTRATION (organisations concerned with government policies and programmes), PRIVATE SECTOR ORGANISATION (for-profit organisations run by individuals and groups,  free from government ownership)., THIRD SECTOR (e.g. non-governmental and non-profit-making organisations,  including charity groups,  community groups etc).Sub-national ministry/agencySmall-medium sized enterpriseNon-governmental organisationYesThere is a mandatory reporting mechanismYesTransnational Kenya, Mazambique, South Africa, Thailand, Viet NamUrban environment, Waste disposal sites, Coastal zoneCollection / sorting of plastics after use, Management of collected plastics, Clean-up of plastic from the environmentReusing plastic, Recycling plasticsHuman health and wellbeing, Biodiversity, Marine organisms, Ecosystem Services, Food chain, Economics and Trade 

Macroplastic (large,  more than 20 mm,  e.g. plastic bottles)Bottles, Plastic bags, Food packaging (containers,  wrappers etc.), Non-food packaging (containers,  wrappers etc.), Fishing related items, Cups (e.g.,  disposable coffee cups), Plastic straws,  stirrers,  cutlery, Sewage-related items (this could include cotton bud sticks,  feminine hygiene items and others disposed of via toilets), Polystyrene itemsNot applicable250000USD125000USDPublic FinancingContinuous activity 1-3 Yearshttps://www.iucn.org/news/marine-and-polar/202002/marplasticcs-funds-projects-promoting-circular-economy-africa-and-asia2020-02-11 18:25:55 UTC2020-02-11 18:48:31 UTC
First Phase545728-545719-55173502YESYESYESCommission on the Protection of the Black Sea Against PollutionOn behalf of an organisationPermanent Secretariat of the Commission on the Protection of the Black Sea Against PollutionYes1Elaboration and Adoption of the Regional Action Plan on Marine Litter ManagementElaboration and adoption of the Regional Action Plan on ML in the Black Sea in October 2018LEGISLATION,  STANDARDS,  RULES: e.g. agreeing new or changing rules or standards that others should comply with,  new regulation,  agreements,  policies,  economic instruments etc. including voluntary commitments.Legislation or regulationsLEGISLATION,  STANDARDS,  RULES: e.g. agreeing new or changing rules or standards that others should comply with,  new regulation,  agreements,  policies,  economic instruments etc. including voluntary commitmentsDeveloperPUBLIC ADMINISTRATION (organisations concerned with government policies and programmes)International bodyYesThere is a mandatory reporting mechanismNoTransnational Bulgaria,  Georgia,  Romania,  Russian Federation,  Turkey,  Ukraine  6 riparian countries of the Black Sea: Bulgaria,  Georgia,  Romania,  Russian Federation,  Turkey,  Ukraine  Entire water catchmentUse / consumption, Collection / sorting of plastics after use, Management of collected plastics, Clean-up of plastic from the environmentReducing plastics, Reusing plastic, Recycling plasticsHuman health and wellbeing, Biodiversity, Marine organisms, Ecosystem Services, Food chain, Economics and TradeMacroplastic (large,  more than 20 mm,  e.g. plastic bottles), Microplastics (tiny plastic particles less than 5 mm in diameter,  e.g.,  found in personal care products/synthetic textiles)Bottles, Plastic bags, Food packaging (containers, wrappers etc.), Non-food packaging (containers, wrappers etc.), Smoking related litter (cigarette butts and packets), Fishing related items, Shipping related items, Cups (e.g., disposable coffee cups), Plastic straws, stirrers, cutlery, Sewage-related items (this could include cotton bud sticks, feminine hygiene items and others disposed of via toilets), Natural disaster/hazard related debris Polystyrene itemsMicrobeads used in cosmetics, Microplastics used in other products e.g. paints 

Packaging, Textiles, Transportation, Building,  Construction,  Demolition, Fisheries, Aquaculture, Wastewater/Sewage managementPublic FinancingContinuous activity more than 3 Years long2020-02-12 10:53:00 UTC2020-02-12 11:28:47 UTC
First Phase545728-545719-55205778YESYESYESUniversity of PlymouthAs an individualYes2H2020 ITN LimnoplastInnovative Training Network for PhD FellowsWORKING WITH PEOPLE: Encouraging or enabling others (e.g.,  education,  training,  communication,  awareness raising,  behaviour change programmesEducation/TrainingOtherPhD training networkTECHNOLOGY and PROCESSES: New technical developments/innovation (e.g.,  research and development,  new product design,  new materials,  processes etc.),  changes in practice,  operations,  environmental management and planningImplementerTHIRD SECTOR (e.g. non-governmental and non-profit-making organisations,  including charity groups,  community groups etc).Educational sectorYesThere is a mandatory reporting mechanismYesTransnational Denmark, France, NetherlandsFreshwater rivers and lakes, Urban environmentRaw materials, Use / consumptionReducing plastics, OtherReplacing conventional polymer Human health and wellbeing, Food chain, OtherFreshwater organismsMicroplastics (tiny plastic particles less than 5 mm in diameter,  e.g.,  found in personal care products/synthetic textiles), OtherWe will also consider macroplastics where  relevant to understanding the flow of microplastics but microplastics are the focus of the projectOtherMicroplastics from all relevant sourcesNot applicable4464286USD0USDPublic FinancingH2020 EU funding programmeContinuous activity more than 3 Years longhttps://www.limnoplast-itn.eu/2020-02-12 18:03:35 UTC2020-02-12 18:32:25 UTC
First Phase545728-545719-55207368YESYESYESUniversity of PlymouthAs an individualNo,  I am returning to the survey to report on additional actions/activitiesInterreg Project Preventing Plastic Pollution (PPP)In the Interreg PPP project,  plastic pollution entering the catchments will be identified,  quantified based on standardised approaches that will be evaluated. These data and conceptual model will be used to identify pollution hotspots and where interventions would be most effective.WORKING WITH PEOPLE: Encouraging or enabling others (e.g.,  education,  training,  communication,  awareness raising,  behaviour change programmesAwareness raising and Behaviour change, Education/Training, WorkshopsInformation campaign, Behaviour change campaign/programme, Community Engagement, Stakeholder EngagementProfessional skills training, Institutional developmentMONITORING and ANALYSIS: Collecting evidence around plastic discharge to the ocean/waterways? (e.g. monitoring,  analysis)ImplementerPUBLIC ADMINISTRATION (organisations concerned with government policies and programmes), PRIVATE SECTOR ORGANISATION (for-profit organisations run by individuals and groups,  free from government ownership)., THIRD SECTOR (e.g. non-governmental and non-profit-making organisations,  including charity groups,  community groups etc).Sub-national ministry/agencySmall-medium sized enterpriseEducational sectorYesThere is a mandatory reporting mechanismYesTransnational France, United Kingdom of Great Britain & Northern Ireland Agricultural land/soils, Entire water catchment, Freshwater rivers and lakes, Urban environment, Waste disposal sites, Coastal zone, Maritime area within national jurisdictionUse / consumption, Collection / sorting of plastics after use, Management of collected plastics, Clean-up of plastic from the environmentReducing plasticsBiodiversity, Marine organisms, Food chain, Economics and TradeMacroplastic (large,  more than 20 mm,  e.g. plastic bottles), Microplastics (tiny plastic particles less than 5 mm in diameter,  e.g.,  found in personal care products/synthetic textiles)Bottles, Plastic bags, Food packaging (containers, wrappers etc.), Non-food packaging (containers, wrappers etc.), Smoking related litter (cigarette butts and packets), Fishing related items, Shipping related items, Cups (e.g., disposable coffee cups), Plastic straws, stirrers, cutlery, Sewage-related items (this could include cotton bud sticks, feminine hygiene items and others disposed of via toilets), Natural disaster/hazard related debris Polystyrene itemsMicrobeads used in cosmetics, Microplastics used in other products e.g. paints 

Packaging, Agriculture, Fisheries, Aquaculture, Food & Beverages, Retail, Tourism, Wastewater/Sewage management11021205USD4799107USDPublic Financing, Private SectorEU Interreg (9.875m) plus co-funding from in-kind contributionsContinuous activity 1-3 Yearshttps://www.plymouth.ac.uk/news/eu14m-project-to-prevent-plastic-pollution-in-the-english-channel2020-02-12 18:34:16 UTC2020-02-12 18:56:22 UTC
First Phase545728-545719-55292096YESYESYESUNEPOn behalf of an organisationUNEPYes2Training of Trainers on Monitoring and Assessment of Marine Litter and Microplastics- To support establishment of monitoring programmes to address the need for quality data and effective monitoring   - strengthen the capacity of countries to use an evidence-based approach to decision makingWORKING WITH PEOPLE: Encouraging or enabling others (e.g.,  education,  training,  communication,  awareness raising,  behaviour change programmesEducation/TrainingProfessional skills trainingMONITORING and ANALYSIS: Collecting evidence around plastic discharge to the ocean/waterways? (e.g. monitoring,  analysis)Funding BodyPUBLIC ADMINISTRATION (organisations concerned with government policies and programmes), THIRD SECTOR (e.g. non-governmental and non-profit-making organisations,  including charity groups,  community groups etc).International body, National ministry/agency, Sub-national ministry/agencyNon-governmental organisation, Community based organisation, Educational sectorYesThere is a mandatory reporting mechanismYesTransnational Cambodial, China, Comoros, France, Indonesia, Kenya, Madagascar, Malaysia, Mauritius, Mazambique, Republic of Korea, Seychelles, Singapore, Somalia, South Africa, Thailand, United Republic ofMountains and upland area, Entire water catchment, Forests or Mangroves, Freshwater rivers and lakes, Urban environment, Coastal zone, Maritime area within national jurisdiction, Areas beyond national jurisdiction, Open ocean and high seasOtherMonitoring and assessment of marine litter data OtherSupport monitoring programmes and effective and quality data as well as strengthen the capacity of countries to use an evidence-based approach to decision making  Human health and wellbeing, Biodiversity, Marine organisms, Ecosystem Services, Food chain, Economics and Trade 

OtherAll marine litter is being taken into account Packaging, Textiles, Transportation, Building, Construction, Demolition Industrial Machinery, Automotive, Electrical and Electronics Agriculture, Fisheries, Aquaculture, Food & Beverages, Personal Healthcare, Medical, Retail, Tourism, Wastewater/Sewage management 134000USDVoluntary donationsContinuous activity 1-3 Yearshttps://wedocs.unep.org/handle/20.500.11822/302642020-02-14 05:59:01 UTC2020-02-14 08:11:58 UTC
First Phase545728-545719-55294518YESYESYESUNEPOn behalf of an organisationUNEPNo,  I am returning to the survey to report on additional actions/activitiesAssessment on Sources,  Pathways and Hazards of Litter including Plastic Litter and Microplastics PollutionImmediately strengthen scientific and technological knowledge with regard to marine litter including marine plastic litter and microplastics  Compiling available scientific and other relevant data and informationTECHNOLOGY and PROCESSES: New technical developments/innovation (e.g.,  research and development,  new product design,  new materials,  processes etc.) changes in practice,  operations,  environmental management and planning.Research and DevelopmentOtherTo compile the latest research and information on marine litter especially plastic litter Funding BodyOtherLead consultant and authors YesThere is a mandatory reporting mechanismNoGlobalMountains and upland area, Agricultural land/soils, Entire water catchment, Forests or Mangroves, Freshwater rivers and lakes, Urban environment, Waste disposal sites, Coastal zone, Maritime area within national jurisdiction, Areas beyond national jurisdiction, Open ocean and high seas, AirRaw materials, Design, Production / Manufacture, Use / consumption, Collection / sorting of plastics after use, Management of collected plastics, Clean-up of plastic from the environment, OtherSources,  pathways and hazards Reducing plastics, Reusing plastic, Recycling plasticsHuman health and wellbeing, Biodiversity, Marine organisms, Ecosystem Services, Food chain, Economics and Trade 

Macroplastic (large,  more than 20 mm,  e.g. plastic bottles), Microplastics (tiny plastic particles less than 5 mm in diameter,  e.g.,  found in personal care products/synthetic textiles), Additives incorporated into plastic itemsBottles, Plastic bags, Food packaging (containers, wrappers etc.), Non-food packaging (containers, wrappers etc.), Smoking related litter (cigarette butts and packets), Fishing related items, Shipping related items, Cups (e.g., disposable coffee cups), Plastic straws, stirrers, cutlery, Sewage-related items (this could include cotton bud sticks, feminine hygiene items and others disposed of via toilets), Natural disaster/hazard related debris Polystyrene itemsMicrobeads used in cosmetics, Microplastics used in other products e.g. paints 

Packaging, Textiles, Transportation, Building, Construction, Demolition Industrial Machinery, Automotive, Electrical and Electronics Agriculture, Fisheries, Aquaculture, Food & Beverages, Personal Healthcare, Medical, Retail, Tourism, Wastewater/Sewage management Voluntary donations, Public FinancingContinuous activity less than one yearhttps://papersmart.unon.org/resolution/uploads/unep_aheg_2019_3_inf_6_progress_on_the_assessment_final.07.11.191.pdfhttps://papersmart.unon.org/resolution/uploads/agenda_item_6d_assessment_and_sac_-_aheg-3_cleared_final.20.11.2019.pdf2020-02-14 08:14:07 UTC2020-02-14 09:44:12 UTC
First Phase545728-545719-55370242YESYESYESIUCNOn behalf of an organisationIUCNNo,  I am returning to the survey to report on additional actions/activitiesEffective,  Quantifiable Solutions To Address Plastic Leakage From Small Island Developing States Adoption of plastic leakage reduction measures by tourism,  fisheries and waste management sectors and value chain development  TECHNOLOGY and PROCESSES: New technical developments/innovation (e.g.,  research and development,  new product design,  new materials,  processes etc.) changes in practice,  operations,  environmental management and planning.New product design, Change in practice, Change in operations, Different environmental management of land based environmentsLEGISLATION,  STANDARDS,  RULES: e.g. agreeing new or changing rules or standards that others should comply with,  new regulation,  agreements,  policies,  economic instruments etc. including voluntary commitments, WORKING WITH PEOPLE: Encouraging or enabling others (e.g.,  education,  training,  communication,  awareness raising,  behaviour change programmes), MONITORING and ANALYSIS: Collecting evidence around plastic discharge to the ocean/waterways? (e.g. monitoring,  analysis)ImplementerPUBLIC ADMINISTRATION (organisations concerned with government policies and programmes), PRIVATE SECTOR ORGANISATION (for-profit organisations run by individuals and groups,  free from government ownership).National ministry/agency, Sub-national ministry/agencySmall-medium sized enterpriseYesThere is a mandatory reporting mechanismYesTransnational Antigua and Barbuda, Cyprus, Fiji, Grenada, Saint Lucia, VanuatuMenorcaUrban environment, Waste disposal sites, Coastal zoneDesign, Production / Manufacture, Use / consumption, Collection / sorting of plastics after use, Management of collected plasticsReducing plastics, Reusing plastic, Recycling plasticsHuman health and wellbeing, Marine organisms, Ecosystem Services, Economics and TradeMacroplastic (large,  more than 20 mm,  e.g. plastic bottles)Bottles, Plastic bags, Food packaging (containers,  wrappers etc.), Non-food packaging (containers,  wrappers etc.), Fishing related items, Shipping related items, Cups (e.g.,  disposable coffee cups), Plastic straws,  stirrers,  cutlery, Sewage-related items (this could include cotton bud sticks,  feminine hygiene items and others disposed of via toilets), Polystyrene itemsFisheries, Tourism, Wastewater/Sewage managementPublic Financing, MixedNORAD  and The Didier and Martine Primat FoundationContinuous activity 1-3 Yearshttps://www.iucn.org/theme/marine-and-polar/our-work/close-plastic-tap-programme/projects2020-02-16 11:34:02 UTC2020-02-16 11:58:30 UTC
