Second Phase545728-545719-63762892YESYESYESOceanographic Institute of University of Sao PauloOn behalf of an organisationUniversity of Sao PauloNo,  I am returning to the survey to report on additional actions/activitiesBook: "Lixo nos Mares: Do entendimento à solução" (pt)/  "Marine debris: From understanding to the solution" (en)Awareness raising,  behaviour change,   education/traininig,  information campaign  WORKING WITH PEOPLE: Encouraging or enabling others (e.g.,  education,  training,  communication,  awareness raising,  behaviour change programmesAwareness raising and Behaviour change, Education/Training, OtherInformation campaign, Behaviour change campaign/programme, Community Engagement, Stakeholder Engagement, Citizen ScienceCurriculum development, Other training programmes, Life-long learningPrimary school, Secondary school, Tertiary higher educationWORKING WITH PEOPLE: Encouraging or enabling others (e.g.,  education,  training,  communication,  awareness raising,  behaviour change programmes)OtherWe are currently developing it and we will be implementing it.OtherA group of institutions,  with representation in the public admistration,  private sector organisation and third sectorYesReporting is voluntaryNoNational BrazilFreshwater rivers and lakes, Urban environment, Waste disposal sites, Coastal zone, Maritime area within national jurisdiction, Areas beyond national jurisdiction, Open ocean and high seas, Not applicableRaw materials, Design, Production / Manufacture, Use / consumption, Collection / sorting of plastics after use, Management of collected plastics, Clean-up of plastic from the environmentNot ApplicableHuman health and wellbeing, Biodiversity, Marine organisms, Ecosystem Services, Food chain, Economics and Trade 

Macroplastic (large,  more than 20 mm,  e.g. plastic bottles), Microplastics (tiny plastic particles less than 5 mm in diameter,  e.g.,  found in personal care products/synthetic textiles), Additives incorporated into plastic itemsBottles, Plastic bags, Food packaging (containers, wrappers etc.), Non-food packaging (containers, wrappers etc.), Smoking related litter (cigarette butts and packets), Fishing related items, Shipping related items, Cups (e.g., disposable coffee cups), Plastic straws, stirrers, cutlery, Sewage-related items (this could include cotton bud sticks, feminine hygiene items and others disposed of via toilets), Natural disaster/hazard related debris Polystyrene itemsMicrobeads used in cosmetics, Microplastics used in other products e.g. paints 

Not applicable4933USDMixedSão Paulo University;  Instituto Socioambiental dos Plasticos - Plastivida;  Instituto Costa Brasilis - Desenvolvimento Socioambiental;  Fórum Setorial Por Um Mar Limpo; Navy of BrazilNot applicablehttp://manejo.io.usp.br/index.phphttp://costabrasilis.org.brhttps://www.instagram.com/entendaolixo/http://porummarlimpo.org.brhttp://www.plastivida.org.br/index.php?lang=pt2020-08-01 00:15:18 UTC2020-08-01 00:56:55 UTC
Third Phase545728-545719-65063247YESYESYESJamaica Environment TrustOn behalf of an organisationJamaica Environment TrustYes1International Coastal Cleanup DayJET has been the national coordinator of International Coastal Cleanup Day in Jamaica since 2008WORKING WITH PEOPLE: Encouraging or enabling others (e.g.,  education,  training,  communication,  awareness raising,  behaviour change programmesAwareness raising and Behaviour change, Education/Training, WorkshopsInformation campaign, Behaviour change campaign/programme, Community Engagement, Stakeholder EngagementOther training programmes, OtherBeach cleanup training sessions for cleanup coordinators ( Safe beach cleanup practices,  data collection,  purpose of beach cleanup etc.)MONITORING and ANALYSIS: Collecting evidence around plastic discharge to the ocean/waterways? (e.g. monitoring,  analysis)ImplementerTHIRD SECTOR (e.g. non-governmental and non-profit-making organisations,  including charity groups,  community groups etc).Non-governmental organisationYesThere is a mandatory reporting mechanismYesNational JamaicaForests or Mangroves, Freshwater rivers and lakes, Coastal zone, Maritime area within national jurisdictionCollection / sorting of plastics after use, Clean-up of plastic from the environmentRecycling plasticsHuman health and wellbeing, Biodiversity, Marine organisms, Ecosystem Services, Food chain, Economics and TradeMacroplastic (large,  more than 20 mm,  e.g. plastic bottles)Bottles, Plastic bags, Food packaging (containers,  wrappers etc.), Non-food packaging (containers,  wrappers etc.), Smoking related litter (cigarette butts and packets), Fishing related items, Shipping related items, Cups (e.g.,  disposable coffee cups), Plastic straws,  stirrers,  cutlery, Polystyrene itemsFisheries, Tourism531055USD30346.02USDPublic Financing, Private SectorTourism Enhancement Fund  Continuous activity more than 3 Years longhttps://www.jamentrust.org/international-coastal-cleanup-day/https://www.jamentrust.org/wp-content/uploads/2016/02/International-Coastal-Cleanup-Day-2019-JAMAICA-National-Report-min.pdfhttps://www.facebook.com/pg/jamentrust/photos/?tab=album&album_id=10157360445133604&ref=page_internalhttps://www.loopjamaica.com/content/scores-gather-participate-coastal-cleanup-project2020-09-09 18:05:33 UTC2020-09-09 19:14:12 UTC
Third Phase545728-545719-65488184YESYESYESColetivação de Limpeza em Mangues,  Praias e Rios de JoinvilleAs an individualNo,  I am returning to the survey to report on additional actions/activitiesLimpeza no ManguezalAtravés das ações,  aproveitamos para conscientizar,  sobre o descarte dos resíduos as águas.WORKING WITH PEOPLE: Encouraging or enabling others (e.g.,  education,  training,  communication,  awareness raising,  behaviour change programmesAwareness raising and Behaviour change, Education/Training, WorkshopsCommunity Engagement, Creative/arts event; exhibitionOther training programmesWORKING WITH PEOPLE: Encouraging or enabling others (e.g.,  education,  training,  communication,  awareness raising,  behaviour change programmes)DeveloperTHIRD SECTOR (e.g. non-governmental and non-profit-making organisations,  including charity groups,  community groups etc).Community based organisationYesThere is a mandatory reporting mechanismYesNational BrazilForests or Mangroves, Freshwater rivers and lakes, Urban environment, Coastal zoneClean-up of plastic from the environmentReducing plastics, Recycling plasticsHuman health and wellbeing, Biodiversity, Marine organismsMacroplastic (large,  more than 20 mm,  e.g. plastic bottles), Microplastics (tiny plastic particles less than 5 mm in diameter,  e.g.,  found in personal care products/synthetic textiles)Bottles, Plastic bags, Food packaging (containers,  wrappers etc.), Non-food packaging (containers,  wrappers etc.), Smoking related litter (cigarette butts and packets), Fishing related items, Cups (e.g.,  disposable coffee cups), Plastic straws,  stirrers,  cutlery, Sewage-related items (this could include cotton bud sticks,  feminine hygiene items and others disposed of via toilets), All of the aboveMicrobeads used in cosmetics, Microplastics used in other products e.g. paints, All of the abovePackaging, Personal HealthcareVoluntary donations, MixedDoaçõesContinuous activity more than 3 Years longhttps://www.facebook.com/coletivoacaodelimpezahttps://www.instagram.com/coletivacaodelimpezadejlle/kalcbaeta@gmail.com2020-09-22 00:15:21 UTC2020-09-22 01:05:15 UTC
Third Phase545728-545719-68742682YESYESYESIndia Water FoundationOn behalf of an organisationIndia Water FoundationYes4Rethink,  Refurbish,  Regenerate•	Replacement of plastics has raised opportunities towards “Resource Efficiency”,  focusing on 3R calling for Reuse Reduce and Recycle strategy but contemporary challenges posed by plastic waste and management has embarked the need to embrace circular principles stressing on Rethinking,  Refurbish and Regenerate and so on because circular model builds on economic,  natural,  and social capital.WORKING WITH PEOPLE: Encouraging or enabling others (e.g.,  education,  training,  communication,  awareness raising,  behaviour change programmesAwareness raising and Behaviour change, Education/Training, WorkshopsInformation campaign, Behaviour change campaign/programme, Community Engagement, Stakeholder Engagement, Creative/arts event; exhibitionCurriculum development, Professional skills training, Life-long learningPrimary school, Secondary schoolWORKING WITH PEOPLE: Encouraging or enabling others (e.g.,  education,  training,  communication,  awareness raising,  behaviour change programmes), TECHNOLOGY and PROCESSES: New technical developments/innovation (e.g.,  research and development,  new product design,  new materials,  processes etc.),  changes in practice,  operations,  environmental management and planningDeveloperPUBLIC ADMINISTRATION (organisations concerned with government policies and programmes), THIRD SECTOR (e.g. non-governmental and non-profit-making organisations,  including charity groups,  community groups etc).Sub-national ministry/agencyNon-governmental organisation, Community based organisation, Educational sectorYesReporting is voluntaryYesNational IndiaEntire water catchment, Freshwater rivers and lakes, Coastal zoneUse / consumption, Clean-up of plastic from the environmentReducing plastics, Reusing plastic, Recycling plasticsHuman health and wellbeing, Biodiversity, Marine organisms, Ecosystem Services, Food chainMacroplastic (large,  more than 20 mm,  e.g. plastic bottles), Microplastics (tiny plastic particles less than 5 mm in diameter,  e.g.,  found in personal care products/synthetic textiles)Bottles, Plastic bags, Food packaging (containers,  wrappers etc.), Smoking related litter (cigarette butts and packets), Fishing related items, Cups (e.g.,  disposable coffee cups), Plastic straws,  stirrers,  cutlery, Sewage-related items (this could include cotton bud sticks,  feminine hygiene items and others disposed of via toilets)Microbeads used in cosmetics, Microplastics used in other products e.g. paints 

Packaging, Fisheries, Aquaculture, Food & Beverages, Personal Healthcare, Medical, Tourism, Wastewater/Sewage management0USD0USDNot applicableThis action was taken by us on a probono basis. We did not charge any feesContinuous activity less than one year2020-12-02 11:18:46 UTC2020-12-02 12:42:26 UTC
Third Phase545728-545719-68768486YESYESYESEarthwatch EuropeOn behalf of an organisationEarthwatch EuropeYes5"On the Go" Plastic Footprint CalculatorAn online survey tool to help individuals understand how much plastic they use and what their biggest uses are. They also tell us about actions they take and the barriers they face to taking more action to reduce plastic.  The tool provides recommendations for how they can reduce use of their top three items. WORKING WITH PEOPLE: Encouraging or enabling others (e.g.,  education,  training,  communication,  awareness raising,  behaviour change programmesAwareness raising and Behaviour changeInformation campaign, Behaviour change campaign/programme, OtherData collection - plastic footprint survey collects data on individual's plastic use,  actions and barriersMONITORING and ANALYSIS: Collecting evidence around plastic discharge to the ocean/waterways? (e.g. monitoring,  analysis)ImplementerTHIRD SECTOR (e.g. non-governmental and non-profit-making organisations,  including charity groups,  community groups etc).Non-governmental organisationYesOtherFor public and scientific information purposesYesNationalUnited Kingdom of Great Britain & Northern Ireland Entire water catchment, Freshwater rivers and lakes, Urban environmentUse / consumptionReducing plastics, Reusing plastic, Recycling plasticsBiodiversity, Ecosystem Services, OtherEcosystem health in generalMacroplastic (large,  more than 20 mm,  e.g. plastic bottles)Bottles, Plastic bags, Food packaging (containers,  wrappers etc.), Non-food packaging (containers,  wrappers etc.), Smoking related litter (cigarette butts and packets), Cups (e.g.,  disposable coffee cups), Plastic straws,  stirrers,  cutlery, Sewage-related items (this could include cotton bud sticks,  feminine hygiene items and others disposed of via toilets)Packaging, Food & Beverages, Personal Healthcare, OtherConvenience food and takeaway sectors9829.6199USDPrivate SectorS C JohnsonContinuous activity 1-3 Yearshttps://plasticfootprint.earthwatch.org.uk/https://earthwatch.org.uk/component/k2/plastic-footprint2020-12-02 15:17:43 UTC2020-12-02 15:49:11 UTC
Third Phase545728-545719-68846086YESYESYESMinisterio del Ambiente y los Recursos Naturales (MARENA) On behalf of an organisationMinisterio del Ambiente y los Recursos Naturales (MARENA) Yes2National Campaign for Education and Environmental Awareness and National Campaign to Clean Beaches and Coasts in SummerDesign and dissemination of educational material related to marine litter,  pamphlet,  vignettes.  Formation of local brigades for the collection of garbage on the coasts.  Follow-up and monitoring of activities and actions.WORKING WITH PEOPLE: Encouraging or enabling others (e.g.,  education,  training,  communication,  awareness raising,  behaviour change programmesAwareness raising and Behaviour change, Education/Training, Workshops, ConferencesInformation campaign, Behaviour change campaign/programme, Community Engagement, Stakeholder Engagement, Citizen Science, Creative/arts event; exhibitionLife-long learning, Institutional developmentWORKING WITH PEOPLE: Encouraging or enabling others (e.g.,  education,  training,  communication,  awareness raising,  behaviour change programmes)ImplementerPUBLIC ADMINISTRATION (organisations concerned with government policies and programmes)National ministry/agencyYesReporting is voluntaryYesNational NicaraguaNICARAGUAForests or Mangroves, Freshwater rivers and lakes, Waste disposal sites, Coastal zone, Areas beyond national jurisdictionUse / consumption, Collection / sorting of plastics after use, Management of collected plastics, Clean-up of plastic from the environmentReducing plastics, Reusing plastic, Recycling plasticsHuman health and wellbeing, Biodiversity, Marine organisms, Ecosystem Services, Food chain, Economics and TradMacroplastic (large,  more than 20 mm,  e.g. plastic bottles)Bottles, Plastic bags, Food packaging (containers,  wrappers etc.), Non-food packaging (containers,  wrappers etc.), Smoking related litter (cigarette butts and packets), Fishing related items, Shipping related items, Cups (e.g.,  disposable coffee cups), Plastic straws,  stirrers,  cutlery, Sewage-related items (this could include cotton bud sticks,  feminine hygiene items and others disposed of via toilets), Natural disaster/hazard related debris, Polystyrene itemsFisheries, Food & Beverages, Tourism, Wastewater/Sewage managementPublic FinancingTreasury funds of the Republic of NicaraguaSingle eventwww.marena.gob.ni 2020-12-03 15:27:59 UTC2020-12-03 21:31:09 UTC
Third Phase545728-545719-68933432YESYESYESOur Blue HandsOn behalf of an organisationOur Blue Hands Organization Yes2Projeto Desplastifique o Oceano  Replacement of single use plastic bags in fresh produce with recycled and returnable polyamide bags collected from ghost fisheries.LEGISLATION,  STANDARDS,  RULES: e.g. agreeing new or changing rules or standards that others should comply with,  new regulation,  agreements,  policies,  economic instruments etc. including voluntary commitments.Legislation or regulationsTECHNOLOGY and PROCESSES: New technical developments/innovation (e.g.,  research and development,  new product design,  new materials,  processes etc.),  changes in practice,  operations,  environmental management and planningDeveloperTHIRD SECTOR (e.g. non-governmental and non-profit-making organisations,  including charity groups,  community groups etc).Non-governmental organisationYesThere is a mandatory reporting mechanismYesNational BrazilAgricultural land/soils, Forests or Mangroves, Freshwater rivers and lakes, Urban environment, Waste disposal sites, Coastal zone, Open ocean and high seasDesign, Production / Manufacture, Use / consumption, Clean-up of plastic from the environmentReducing plastics, Reusing plastic, Recycling plasticsBiodiversity, Marine organisms, Ecosystem Services, Economics and TradeMacroplastic (large,  more than 20 mm,  e.g. plastic bottles)Plastic bags, Food packaging (containers,  wrappers etc.), Non-food packaging (containers,  wrappers etc.), Fishing related itemsPackaging, Food & Beverages, Tourism, Wastewater/Sewage management0USD0USDCrowdfunded, Voluntary donations, Public Financing, Private Sector, MixedContinuous activity 1-3 Years2020-12-05 00:10:28 UTC2020-12-05 00:52:41 UTC
Third Phase545728-545719-68934027YESYESYESOur Blue Hands OrganizationOn behalf of an organisationOur Blue Hands No,  I am returning to the survey to report on additional actions/activitiesProjeto Oceano Mais Limpo This action consists of the application and multiplication of the microplastic collection methodology on the beaches of the south and southeast coast of Brazil,  simultaneously on two important and tourist islands in Brazil. The generation of microplastic data to provide a data supply for the creation of a database of plastic and microplastics within a Brazilian panorama.WORKING WITH PEOPLE: Encouraging or enabling others (e.g.,  education,  training,  communication,  awareness raising,  behaviour change programmesWorkshopsMONITORING and ANALYSIS: Collecting evidence around plastic discharge to the ocean/waterways? (e.g. monitoring,  analysis)ImplementerTHIRD SECTOR (e.g. non-governmental and non-profit-making organisations,  including charity groups,  community groups etc).Non-governmental organisationYesThere is a mandatory reporting mechanismYesNational BrazilForests or Mangroves, Freshwater rivers and lakes, Urban environment, Waste disposal sites, Coastal zone, Maritime area within national jurisdiction, Open ocean and high seasCollection / sorting of plastics after use, Management of collected plastics, Clean-up of plastic from the environmentReducing plastics, Recycling plasticsBiodiversity, Marine organisms, Ecosystem ServicesMicroplastics (tiny plastic particles less than 5 mm in diameter,  e.g.,  found in personal care products/synthetic textiles), Additives incorporated into plastic itemsMicroplastics used in other products e.g. paintsPackaging, Textiles, Transportation, Building,  Construction,  Demolition, Fisheries, Personal Healthcare, Tourism, Wastewater/Sewage management0USD0USDCrowdfunded, Voluntary donations, Public Financing, Private Sector, MixedContinuous activity more than 3 Years long2020-12-05 00:53:03 UTC2020-12-05 01:31:37 UTC
Third Phase545728-545719-69095542YESYESYESUniversidade Federal Rural do Semi Árido,  Rio Grande do norte,  /BrazilOtherAs a university extension projectYes1Mossoró Limpa da Cidade Ao Mar ( Mossoró Cleans City from Sea) The project proposes to carry out educational actions  in two schools in the city of Mossoró - RN,  in order to  sensitize people about the problem of waste in natural environments and  how we can mimic these impacts in a simple way,  on a daily basis.  Interventions will be carried out in schools,  on the beach and in the Park  Municipality of Mossoró. This project aims to raise awareness of the maximum  students on environmental valuation and the importance of a clean and healthy environment and consequently the need for maintenance of biodiversity.WORKING WITH PEOPLE: Encouraging or enabling others (e.g.,  education,  training,  communication,  awareness raising,  behaviour change programmesEducation/TrainingProfessional skills training, Life-long learning, Institutional developmentFunding BodyPUBLIC ADMINISTRATION (organisations concerned with government policies and programmes)National ministry/agencyNot applicableOtherNot yet. The project had to be stopped due to the pandemic. The evaluation of the result turns when the project resumes activities National BrazilUrban environmentRaw materials, Design, Production / Manufacture, Use / consumption, Collection / sorting of plastics after use, Management of collected plastics, Clean-up of plastic from the environmentReducing plastics, Reusing plastic, Recycling plasticsHuman health and wellbeing, Biodiversity, Marine organisms, Ecosystem Services, Food chain, Economics and Trade 

Macroplastic (large,  more than 20 mm,  e.g. plastic bottles), Microplastics (tiny plastic particles less than 5 mm in diameter,  e.g.,  found in personal care products/synthetic textiles)Bottles, Plastic bags, Food packaging (containers, wrappers etc.), Non-food packaging (containers, wrappers etc.), Smoking related litter (cigarette butts and packets), Fishing related items, Shipping related items, Cups (e.g., disposable coffee cups), Plastic straws, stirrers, cutlery, Sewage-related items (this could include cotton bud sticks, feminine hygiene items and others disposed of via toilets), Natural disaster/hazard related debris Polystyrene itemsMicrobeads used in cosmetics, Microplastics used in other products e.g. paints 

Not applicable370USDPublic FinancingContinuous activity 1-3 Years2020-12-08 14:21:13 UTC
Third Phase545728-545719-69120559YESYESYESUniversidade do Estado do Rio de Janeiro (UERJ) and Stand UPETOn behalf of an organisationStand UPETYes2Reusing Plastic Bottles into Standup Paddle BoardsConstruction worshops of standup paddle boards. Reusing plastic bottles (pet); discussions of marine plastic pollution problems on marine ecossystems; paddle day on the beach using the boards,  beach cleaning and environmental education with kids.TECHNOLOGY and PROCESSES: New technical developments/innovation (e.g.,  research and development,  new product design,  new materials,  processes etc.) changes in practice,  operations,  environmental management and planning.New product design, Change in service provision, Change in practice, Research and DevelopmentReducing the environmental impact, Developing a new material, Developing a new process, Manufacturing and Production, Waste ManagementWORKING WITH PEOPLE: Encouraging or enabling others (e.g.,  education,  training,  communication,  awareness raising,  behaviour change programmes)DeveloperTHIRD SECTOR (e.g. non-governmental and non-profit-making organisations,  including charity groups,  community groups etc).Community based organisation, OtherUniversity Extension Project YesThere is a mandatory reporting mechanismNoNationalNational ( we´ve worked in 9 states of Brazil ),  but focused on Rio de Janeiro BrazilMountains and upland area, Agricultural land/soils, Forests or Mangroves, Freshwater rivers and lakes, Urban environment, Coastal zoneDesign, Collection / sorting of plastics after use, Management of collected plastics, Clean-up of plastic from the environmentReducing plastics, Reusing plasticHuman health and wellbeingMacroplastic (large,  more than 20 mm,  e.g. plastic bottles)BottlesTransportation, Aquaculture, Personal Healthcare, Tourism4933USD123USDOtherUniversity scholarship / value per month since april 2019SR3 - UERJContinuous activity 1-3 Yearshttps://standupet.com.br/https://www.instagram.com/standupet/https://g1.globo.com/rio-de-janeiro/noticia/estudantes-do-rio-criam-prancha-ecologica-de-stand-up-paddle-que-custa-15-vezes-menos-que-valor-de-mercado.ghtmlhttps://recordtv.r7.com/balanco-geral-rj/videos/estudantes-da-uerj-fazem-prancha-de-surfe-com-garrafas-pet-18022020https://globoplay.globo.com/v/7240594/programa/2020-12-08 20:40:37 UTC
Third Phase545728-545719-69404642YESYESYESSecretariat of the Basel,  Rotterdam and Stockholm Conventions,  UNEPOn behalf of an organisationSecretariat of the Basel,  Rotterdam and Stockholm Conventions,  UNEPNo,  I am returning to the survey to report on additional actions/activitiesBasel Convention Plastic Waste AmendmentsThe fourteenth meeting of the Conference of the Parties to the Basel Convention (COP-14,  29 April–10 May 2019) adopted amendments to Annexes II,  VIII and IX to the Convention with the objectives of enhancing the control of the transboundary movements of plastic waste and clarifying the scope of the Convention as it applies to such waste.LEGISLATION,  STANDARDS,  RULES: e.g. agreeing new or changing rules or standards that others should comply with,  new regulation,  agreements,  policies,  economic instruments etc. including voluntary commitments.Official agreements, Policy change or development, High-level strategy, Legislation or regulations, New standard(s) or guideline(s)LEGISLATION,  STANDARDS,  RULES: e.g. agreeing new or changing rules or standards that others should comply with,  new regulation,  agreements,  policies,  economic instruments etc. including voluntary commitmentsOtherWe provide the Secretariat role to the Basel Convention.PUBLIC ADMINISTRATION (organisations concerned with government policies and programmes)National ministry/agencyYesThere is a mandatory reporting mechanismYesRegionalBasel Convention,Rotterdam Convention, Stockholm ConventionMountains and upland area, Agricultural land/soils, Entire water catchment, Forests or Mangroves, Freshwater rivers and lakes, Urban environment, Waste disposal sites, Coastal zone, Maritime area within national jurisdiction, Areas beyond national jurisdiction, Open ocean and high seas, AirRaw materials, Design, Production / Manufacture, Use / consumption, Collection / sorting of plastics after use, Management of collected plastics, Clean-up of plastic from the environmentReducing plastics, Reusing plastic, Recycling plasticsHuman health and wellbeing, Biodiversity, Marine organisms, Ecosystem Services, Food chain, Economics and Trade 

