When submitted?Unique Response NumberIntroduction1. I agree to share the information provided in this survey. (Note we will not share your name,  role or email address).2. I will provide the answers that reflect the best of my knowledge and facts available to me.3. I have received adequate information about the survey and about my ethical rights as a participant,  including my right to withdraw. I consent to take part in this research4.d. Your organisation (If you are not affiliated with an organisation,  please write 'not applicable').5. Are you reporting as an individual or on behalf of an organisation? (Several reports from the same organisation or individual are welcome)5.a. If you selected Other,  please specify:5.b. On behalf of which organisation are you reporting here? (e.g. UNEP,  FAO or name your specific private/public/third sector organisation).6. Is this the first time that you have completed this survey?6.a. How many Actions are you intending to tell us about?7. Please enter a name/title for this action/activity.8. Please provide a very short summary of the action/activity (keywords or bullet points are fine,  e.g. change to production,  deposit return scheme etc.).9. TYPE OF ACTION: What did the MAIN action/activity focus on? (Please tick ONE which best describes the action you are reporting).9.a. You have chosen legislation,  standards,  rules as the type of action. Specifically,  what did the action involve? (Please tick ALL that apply).9.a.i. If you selected Other,  please specify:9.b. You’ve chosen “working with people” as the type of action. Specifically,  what did the action involve? (Please tick ALL that apply):9.b.i. If you selected Other,  please specify:9.b.ii. Did the awareness raising and behaviour change action/activity involve: (Please tick ALL that apply).9.b.ii.a. If you selected Other,  please specify:9.b.iii. Did the Education/Training action/activity involve: (Please tick ALL that apply)9.b.iii.a. If you selected Other,  please specify:9.b.iii.b. Did the curriculum development involve: (Please tick ALL that apply)9.b.iii.b.i. If you selected Other,  please specify:9.c. You’ve chosen “technology and processes” as the type of action. Specifically,  what did the action involve? (Please tick ALL that apply):9.c.i. If you selected Other,  please specify:9.c.ii. Did the research and development involve (Please tick ALL that apply):9.c.ii.a. If you selected Other,  please specify:9.d. You’ve chosen “monitoring and analysis” as the type of action. Specifically,  what did the action involve? (Please tick ALL that apply and if a specific protocol was used,  please state it e.g. OSPAR,  NOAA,  Beachwatch,  EU-MSFD,  Clean Seas,  UNEP,  Ocean Conservancy etc.):9.d.i. If you selected Other,  please specify:9.d.ii. For monitoring on or near ocean surfaces,  which programme/protocol did you use?9.d.iii. For monitoring of the water column,  which programme/protocol did you use?9.d.iv. For monitoring on the seafloor,  which programme/protocol did you use?9.d.v. For monitoring on the shoreline,  which programme/protocol did you use?9.d.vi. For monitoring in Biota,  which programme/protocol did you use?9.d.vii. For air monitoring,  which programme/protocol did you use?9.d.viii. How can the data and information from your monitoring programme be accessed?9.d.viii.a. If the monitoring data is available on request,  please provide information on how to access the data?9.d.viii.b. Please provide the URL's for any links to the monitoring data and information.10. TYPE OF ACTION: Whilst you already selected the focus of your action/activity in Question 9,  did the action/activity also involve other aspects (please tick which ones below):11. What is the organisation's role regarding this action: [ACTION]11.a. If you selected Other,  please specify:12. Who is responsible for the action implementation?12.a. If you selected Other,  please specify:12.b. Is the Public Administration body a........12.b.i. If you selected Other,  please specify:12.c. Is the Private sector organisation a........12.c.i. If you selected Other,  please specify:12.d. Is the third sector organisation a......12.d.i. If you selected Other,  please specify:13. Reporting and evaluations: Do you report on the action?13.a. You answered that you do report on the action. Is this because:13.a.i. If you selected Other,  please specify:13.b. You answered that you do not report on the action. Is this because:13.b.i. If you selected Other,  please specify:14. Are the actual outcomes and impacts of the action evaluated?14.a. If you selected Other,  please specify:15. What’s the geographical focus of the action?15.a. If you selected Other,  please specify:16.a. If you selected Other,  please specify:17. Which specific place or area is your action targeting? (Please tick all that apply)17.a. If you selected Other,  please specify:18. Which specific part of the lifecycle/plastic supply chain is your action targeting? (Please tick all that apply)18.a. If you selected Other,  please specify:19. Does your action target the following? (Please tick all that apply)19.a. If you selected Other,  please specify:20. What impacts or harms does the action relate to? (Please tick all that apply)20.a. If you selected Other,  please specify:21. What types of items or contaminants does the action target?21.a. If you selected Other,  please specify:21.b. What type of macroplastic contaminant does the action target? (Please tick all that apply)21.b.i. If you selected Other,  please specify:21.c. What type of microplastic contaminant does the action target?21.c.i. If you selected Other,  please specify:22. Does your action target a specific sector? (Please tick all that apply)22.a. If you selected Other,  please specify:23. Converted into USD  (to 0 decimal places) 23. How much money (amount) has been invested in the action so far? (please give us an estimate if you’re unsure and only submit numbers,  e.g,  5, 000 should be entered as 5000)24. All currency now IN USD25. Converted into USD: Are there in kind contributions as well? (Please tell us the equivalent amount and only submit numbers,  e.g,  5, 000 should be entered as 5000).26. All currency now IN USD27. What funding sources did you use?27.a. If you selected Other,  please specify:27.b. Please name the specific source(s) of funding?28. Is your action a one-off activity or continuous?28.a. If you selected Other,  please specify:29. In the boxes below,  please provide i.e. copy and paste links,  URL's,  website links etc to documents about your action. We are interested in websites,  reports,  images,  media articles etc. Please place only one link per box provided. If you have no documents to share,  please write 'I have no links to provide' in the first box. You can also email documents and images - as attachments - to marinelitterstocktake@plymouth.ac.uk29.a. Another Link29.b. Another link to information:29.c. Another link to information29.d. Another link to information29.e. Another link to informationStartDateCompletionDate
First Phase545728-545719-53376637YESYESYESThe SeaCleanersOn behalf of an organisationThe SeaCleanersYes4Awareness RaisingAwareness raising activities in schools,  trade fair,  corporate companiesWORKING WITH PEOPLE: Encouraging or enabling others (e.g.,  education,  training,  communication,  awareness raising,  behaviour change programmesAwareness raising and Behaviour change,  Education/Training,  Workshops,  ConferencesInformation campaign,  Behaviour change campaign/programme,  Community Engagement,  Stakeholder EngagementProfessional skills training,  Institutional developmentImplementerTHIRD SECTOR (e.g. non-governmental and non-profit-making organisations,  including charity groups,  community groups etc).Non-governmental organisationNoThere are not enough resources to support reportingNoTransnational France, Germany, Indonesia, SwitzerlandCoastal zone,  Maritime area within national jurisdiction,  Areas beyond national jurisdiction,  Open ocean and high seasRaw materials, Design, Production / Manufacture, Use / consumption, Collection / sorting of plastics after use, Management of collected plastics, Clean-up of plastic from the environmentReducing plastics,  Reusing plastic,  Recycling plasticsHuman health and wellbeing,  Biodiversity,  Marine organisms,  Ecosystem Services,  Food chain,  Economics and TradeMacroplastic (large,  more than 20 mm,  e.g. plastic bottles)Bottles, Plastic bags, Food packaging (containers, wrappers etc.), Non-food packaging (containers, wrappers etc.), Smoking related litter (cigarette butts and packets), Fishing related items, Shipping related items, Cups (e.g., disposable coffee cups), Plastic straws, stirrers, cutlery, Sewage-related items (this could include cotton bud sticks, feminine hygiene items and others disposed of via toilets), Natural disaster/hazard related debris Polystyrene itemsPackaging, Textiles, Transportation, Building, Construction, Demolition Industrial Machinery, Automotive, Electrical and Electronics Agriculture, Fisheries, Aquaculture, Food & Beverages, Personal Healthcare, Medical, Retail, Tourism, Wastewater/Sewage management 334821USD558036USDVoluntary donations,  Private SectorPrivate sponsorshipContinuous activity 1-3 Yearshttps://www.theseacleaners.org/en/educational-hub/2019-12-20 17:36:36 UTC2019-12-30 15:42:40 UTC
First Phase545728-545719-53649934YESYESYESThe Institute of Environmental Science and ResearchAs an individualYes4New Zealand Plastic Bag BanGovernment ban of the use of single-use plastic bags in New Zealand. LEGISLATION,  STANDARDS,  RULES: e.g. agreeing new or changing rules or standards that others should comply with,  new regulation,  agreements,  policies,  economic instruments etc. including voluntary commitments.Official agreements,  Policy change or development,  Legislation or regulations,  Ban(s)WORKING WITH PEOPLE: Encouraging or enabling others (e.g.,  education,  training,  communication,  awareness raising,  behaviour change programmes)PUBLIC ADMINISTRATION (organisations concerned with government policies and programmes), PRIVATE SECTOR ORGANISATION (for-profit organisations run by individuals and groups,  free from government ownership).National ministry/agencyNational Corporation,  Small-medium sized enterpriseNoOtherSubmitter is not involved in the process.OtherThe results of the ban are being indirectly monitored by other initiatives.National New ZealandNew ZealandMountains and upland area, Agricultural land/soils, Entire water catchment, Forests or Mangroves, Freshwater rivers and lakes, Urban environment, Waste disposal sites, Coastal zone, Maritime area within national jurisdiction, Areas beyond national jurisdiction, Open ocean and high seas, AirUse / consumptionReducing plasticsHuman health and wellbeing, Biodiversity, Marine organisms, Ecosystem Services, Food chain, Economics and Trade 

Macroplastic (large,  more than 20 mm,  e.g. plastic bottles)Plastic bagsRetailNot applicableContinuous activity more than 3 Years longhttps://www.mfe.govt.nz/waste/single-use-plastic-shopping-bags-banned-new-zealand2020-01-07 22:32:59 UTC2020-01-07 23:05:20 UTC
First Phase545728-545719-53668499YESYESYESSecretariat of the Basel,  Rotterdam and Stockholm ConventionsOn behalf of an organisationSecretariat of the Basel,  Rotterdam and Stockholm ConventionsYes3Updating the Technical Guidelines for the Identification and Environmentally Sound Management of Plastic Wastes and for their DisposalAt its sixth meeting held in December 2002,  the Conference of the Parties (COP) to the Basel Convention adopted the technical guidelines for the identification and environmentally sound management (ESM) of plastic wastes and for their disposal. At its fourteenth meeting held in May 2019,  in its decision BC-14/13,  the COP decided to update the technical guidelines on plastic waste and established a small intersessional working group. The group is led by China,  Japan and the United Kingdom of Great Britain and Northern Ireland and consists of experts nominated by Parties and others. The group will prepare draft updated technical guidelines for consideration at the twelfth meeting of the Open-ended Working Group of the Basel Convention to be held in June 2020. A further revised version will then be considered at the fifteenth meeting of the COP to be held in May 2021 for possible adoption. The technical guidelines include the following:  • Sources of plastic waste (pre-user and post-user)  • Environmentally sound and safe handling,  compaction,  transport,  storage and shipping of plastic waste  • Health and safety issues  • Fire safety  • Second life applications for plastics material  • Energy recovery from plastic waste  • Final disposal of plastic waste  • Technical guidelines on the environmentally sound management of plastic-coated cables scrap  LEGISLATION,  STANDARDS,  RULES: e.g. agreeing new or changing rules or standards that others should comply with,  new regulation,  agreements,  policies,  economic instruments etc. including voluntary commitments.Policy change or development, New standard(s) or guideline(s)TECHNOLOGY and PROCESSES: New technical developments/innovation (e.g.,  research and development,  new product design,  new materials,  processes etc.),  changes in practice,  operations,  environmental management and planningOtherWe are supporting parties and others,  to update the technical guidelines as the Secretariat of the Basel Convention and requested by the COP decision.PUBLIC ADMINISTRATION (organisations concerned with government policies and programmes),  PRIVATE SECTOR ORGANISATION (for-profit organisations run by individuals and groups,  free from government ownership),  THIRD SECTOR (e.g. non-governmental and non-profit-making organisations,  including charity groups,  community groups etc),  OtherThe technical guidelines if adopted at the COP of the Basel Convention will become a reference standard agreed at the international level for the environmentally sound management of plastic wastes,  but it is not mandatory to any stakeholder to follow it. International body,  National ministry/agency,  Sub-national ministry/agencyMultinational Corporation,  National Corporation,  Small-medium sized enterpriseNon-governmental organisation,  Community based organisation,  Educational sectorYesThere is a mandatory reporting mechanismNoTransnationalBasel Convention,Rotterdam Convention, Stockholm ConventionMountains and upland area, Agricultural land/soils, Entire water catchment, Forests or Mangroves, Freshwater rivers and lakes, Urban environment, Waste disposal sites, Coastal zone, Maritime area within national jurisdiction, Areas beyond national jurisdiction, Open ocean and high seas, AirCollection/ sorting of plastics after use,  Management of collected plastics.Reducing plastics , Recycling plasticsHuman health and wellbeing.Macroplastic (large,  more than 20 mm,  e.g. plastic bottles), Microplastics (tiny plastic particles less than 5 mm in diameter,  e.g.,  found in personal care products/synthetic textiles),  Additives incorporated into plastic items.Bottles, Plastic bags, Food packaging (containers, wrappers etc.), Non-food packaging (containers, wrappers etc.), Smoking related litter (cigarette butts and packets), Fishing related items, Shipping related items, Cups (e.g., disposable coffee cups), Plastic straws, stirrers, cutlery, Sewage-related items (this could include cotton bud sticks, feminine hygiene items and others disposed of via toilets), Natural disaster/hazard related debris Polystyrene itemsMicrobeads used in cosmetics, Microplastics used in other products e.g. paints 

Packaging, Textiles, Transportation, Building, Construction, Demolition Industrial Machinery, Automotive, Electrical and Electronics Agriculture, Fisheries, Aquaculture, Food & Beverages, Personal Healthcare, Medical, Retail, Tourism, Wastewater/Sewage management 10000USDOtherStaff time,  IT resources for online meetingsCore funds of the conventionContinuous activity 1-3 Yearshttp://www.basel.int/Implementation/Plasticwastes/Technicalguidelines/Overview/tabid/7992/Default.aspx2020-01-08 13:54:19 UTC2020-01-10 15:05:07 UTC
First Phase545728-545719-53741002YESYESYESDirección del Parque Nacional GalápagosOn behalf of an organisationDirección del Parque Nacional GalápagosYes1Limpieza Costera en GalápagosSe realizan viajes en diferentes embarcaciones alrededor de las islas Galápagos,  llegando a sitios no turísticos,  en los cuales se ha evidenciado la basura plástica marina,  se recolecta y clasifica de acuerdo a su tipo y procedencia. Además de realizar actividades y monitoreos con microplásticos.WORKING WITH PEOPLE: Encouraging or enabling others (e.g.,  education,  training,  communication,  awareness raising,  behaviour change programmesOtherLimpieza y recolección de basura plástica marina y microplásticosMONITORING and ANALYSIS: Collecting evidence around plastic discharge to the ocean/waterways? (e.g. monitoring,  analysis)DeveloperPUBLIC ADMINISTRATION (organisations concerned with government policies and programmes)National ministry/agencyYesThere is a mandatory reporting mechanismYesSub-national EcuadorCoastal zoneManagement of collected plastics, Clean-up of plastic from the environmentReducing plasticsBiodiversity, Marine organisms, Ecosystem Services, Food chainMacroplastic (large,  more than 20 mm,  e.g. plastic bottles), Microplastics (tiny plastic particles less than 5 mm in diameter,  e.g.,  found in personal care products/synthetic textiles)Bottles, Plastic bags, Food packaging (containers,  wrappers etc.), Fishing related items, Plastic straws,  stirrers,  cutlery, Polystyrene itemsOtherPelletsFisheries, Food & Beverages50000USD50000USDPublic Financing, Private SectorFondos Coca ColaContinuous activity more than 3 Years longhttp://www.galapagos.gob.ec/46-toneladas-de-basura-fueron-retiradas-de-las-costas-de-galapagos/http://www.ambiente.gob.ec/limpieza-costera-unio-comunidad-e-instituciones-en-galapagos/http://www.galapagos.gob.ec/galapagos-se-sumo-a-la-iniciativa-accion-por-el-planeta/https://conservation.org.ec/boletines/iniciativa-limpieza-costera-retiro-2-5-toneladas-en-primer-viaje-a-sitios-remotos-de-galapagos/?frame=02020-01-10 14:06:52 UTC2020-01-10 16:21:59 UTC
First Phase545728-545719-53853866YESYESYESInstitute of Oceanography and Fisheries,  Split,  Croatia. As an individualYes1Fishing for LitterFisheries is a sector that can make a significant contribution to solving the problem of marine litter,  by participating in its removal through the "Fishing for Litter" (FfL) initiative. This practice relates to the collection of litter from the sea that are caught in the nets during fishing,  and its disposal on the shore in communal containers where it is handled within the existing waste management system without reimbursement for fishermen. This report presents the experiences and achievements of the EU ML-REPAIR project in Croatia that could be used to further develop the litter accumulated on sea bottom disposal initiative in the Croatian part of the Adriatic. One of the project goals is to design new strategies to reduce the marine litter quantities in the Adriatic Sea. Project activities were conceived through the cross-border cooperation of partners from the INTEREG ITA-CRO,  dealing with the problem of marine litter removing by involving the fisheries sector. These initiatives on the Croatian side of the Adriatic Sea are managed and coordinated by the Institute for Oceanography and Fisheries (IZOR) from Split,  one of the partners in the project. The initiative was a reflection of the operational methods of pilot-programs implemented in Western European countries (the Netherlands,  Denmark,  Sweden and the United Kingdom) based on the experiences of KIMO Networks participating in such programs,  such as Fishing-for-Litter Scotland.WORKING WITH PEOPLE: Encouraging or enabling others (e.g.,  education,  training,  communication,  awareness raising,  behaviour change programmesAwareness raising and Behaviour change, Education/Training, WorkshopsInformation campaign, Behaviour change campaign/programme, Community Engagement, Stakeholder EngagementOther training programmes, Institutional developmentLEGISLATION,  STANDARDS,  RULES: e.g. agreeing new or changing rules or standards that others should comply with,  new regulation,  agreements,  policies,  economic instruments etc. including voluntary commitments, MONITORING and ANALYSIS: Collecting evidence around plastic discharge to the ocean/waterways? (e.g. monitoring,  analysis)ImplementerPUBLIC ADMINISTRATION (organisations concerned with government policies and programmes)Sub-national ministry/agencyYesReporting is voluntaryYesNational CroatiaMaritime area within national jurisdictionRaw materials, Design, Production / Manufacture, Use / consumption, Collection / sorting of plastics after use, Management of collected plastics, Clean-up of plastic from the environmentReducing plasticsHuman health and wellbeing, Biodiversity, Marine organisms, Ecosystem Services, Food chain, Economics and TradeMacroplastic (large,  more than 20 mm,  e.g. plastic bottles)Bottles, Plastic bags, Food packaging (containers, wrappers etc.), Non-food packaging (containers, wrappers etc.), Smoking related litter (cigarette butts and packets), Fishing related items, Shipping related items, Cups (e.g., disposable coffee cups), Plastic straws, stirrers, cutlery, Sewage-related items (this could include cotton bud sticks, feminine hygiene items and others disposed of via toilets), Natural disaster/hazard related debris Polystyrene itemsPackaging, Textiles, Transportation, Building, Construction, Demolition Industrial Machinery, Automotive, Electrical and Electronics Agriculture, Fisheries, Aquaculture, Food & Beverages, Personal Healthcare, Medical, Retail, Tourism, Wastewater/Sewage management 55804USDOtherEuropean Union funds through InterReg projectInterreg fundingContinuous activity 1-3 Yearshttp://www.ml-repair.eu/enhttp://www.defishgear.net/desert2/itemlist/tag/fishing%20for%20litterhttps://www.jutarnji.hr/vijesti/hrvatska/alarm-na-jadranu-uskoro-bi-u-njemu-moglo-biti-vise-plastike-nego-ribe-stigli-zapanjujuci-podaci-o-otpadu-evo-koje-proizvode-najvise-bacamo-u-more/8182376/https://net.hr/danas/hrvatska/ponosni-ste-na-predivan-i-cist-jadran-velika-je-to-zabluda-jadransko-more-je-medu-najazagadenijima-u-europi-razlog-stvarno-ljuti/http://www.ml-repair.eu/attachment/preview/5dc978067a693/clanak-1.pdfhttps://komunalne-djelatnosti.hr/wp-content/uploads/2019/02/Brosura-Fishing-for-litter.pdf2020-01-14 12:48:24 UTC2020-01-14 13:33:37 UTC
First Phase545728-545719-53855495YESYESYESUNEPOn behalf of an organisationUNEP Law DivisionYes1Legislative Guidance to Countries on Marine Litter,  Microplastics and Single-use Plastics.Legislative assistance to countriesLEGISLATION,  STANDARDS,  RULES: e.g. agreeing new or changing rules or standards that others should comply with,  new regulation,  agreements,  policies,  economic instruments etc. including voluntary commitments.Legislation or regulationsWORKING WITH PEOPLE: Encouraging or enabling others (e.g.,  education,  training,  communication,  awareness raising,  behaviour change programmes)Funding BodyPUBLIC ADMINISTRATION (organisations concerned with government policies and programmes)National ministry/agencyYesThere is a mandatory reporting mechanismYesGlobalOtherLifecycle of plastics (production,  distribution,  packaging,  waste management)Raw materials, Design, Production / Manufacture, Use / consumption, Collection / sorting of plastics after use, Management of collected plastics, Clean-up of plastic from the environment, OtherIt depends on the country needs  1) a general global guidance is being developed  2) upon request from countries,  there is a gap analysis to identify regulatory gaps so as to provide targeted legal assistanceOtherIt depends on the country needs  1) a general global guidance is being developed  2) upon request from countries,  there is a gap analysis to identify regulatory gaps so as to provide targeted legal assistanceHuman health and wellbeing, Biodiversity, Marine organisms, Ecosystem Services, Food chain, Economics and Trade, Other

Depends of country needs and prioritiesMacroplastic (large,  more than 20 mm,  e.g. plastic bottles), Microplastics (tiny plastic particles less than 5 mm in diameter,  e.g.,  found in personal care products/synthetic textiles)Bottles, Plastic bags, Food packaging (containers, wrappers etc.), Non-food packaging (containers, wrappers etc.), Smoking related litter (cigarette butts and packets), Fishing related items, Shipping related items, Cups (e.g., disposable coffee cups), Plastic straws, stirrers, cutlery, Sewage-related items (this could include cotton bud sticks, feminine hygiene items and others disposed of via toilets), Natural disaster/hazard related debris Polystyrene items, OtherDepends on country needs and prioritiesOtherDepends on country needs and prioritiesPackaging, Textiles, Transportation, Food & Beverages, Personal Healthcare, Wastewater/Sewage management, OtherMainly the sectors checked,  but it depends on country needs and priorities.150000USD50000USDVoluntary donationsContinuous activity more than 3 Years longhttps://www.unenvironment.org/resources/report/legal-limits-single-use-plastics-and-microplastics2020-01-14 13:15:32 UTC2020-01-14 14:43:51 UTC
