First Phase545728-545719-54543200YESYESYESUnited States Government - Environmental Protection AgencyOn behalf of an organisationUnited States Government - Environmental Protection AgencyNo,  I am returning to the survey to report on additional actions/activitiesCommission for Economic Cooperation (CEC) North American Marine Litter ProjectSince 2018,  U.S. EPA has worked through the CEC to address marine litter in the North American border watersheds through stakeholder engagement at the local level. The CEC projects have totalled over $1 million and have engaged stakeholders in the Salish Sea and Tijuana River watersheds to address land-based sources of marine litter. Projects in the watersheds focused on installing stormwater trash capture devices in Vancouver,  Canada,  and Bellingham,  Washington,  USA and monitoring the devices to better identify sources and types of litter entering the watershed. In Tijuana,  efforts focused heavily on raising awareness on single-use plastics and solid waste management. WORKING WITH PEOPLE: Encouraging or enabling others (e.g.,  education,  training,  communication,  awareness raising,  behaviour change programmesEducation/Training, WorkshopsInstitutional developmentMONITORING and ANALYSIS: Collecting evidence around plastic discharge to the ocean/waterways? (e.g. monitoring,  analysis)OtherUnited States,  along with Canada and Mexico,  developed this project through the CEC as part of the North American Free Trade Agreement (NAFTA)PRIVATE SECTOR ORGANISATION (for-profit organisations run by individuals and groups,  free from government ownership)., THIRD SECTOR (e.g. non-governmental and non-profit-making organisations,  including charity groups,  community groups etc).Small-medium sized enterpriseNon-governmental organisation, Community based organisationYesThere is a mandatory reporting mechanismNoTransnational Canada,  Mexico,  United States of AmericaEntire water catchment, Freshwater rivers and lakes, Urban environment, Coastal zoneUse / consumption, Clean-up of plastic from the environment, OtherPrevention from entering stormwater and riverine environmentsReducing plastics, Reusing plasticHuman health and wellbeing, Economics and Trade, OtherSustainable development,  resource conservationMacroplastic (large,  more than 20 mm,  e.g. plastic bottles), Microplastics (tiny plastic particles less than 5 mm in diameter,  e.g.,  found in personal care products/synthetic textiles)Bottles, Plastic bags, Food packaging (containers,  wrappers etc.), Non-food packaging (containers,  wrappers etc.), Smoking related litter (cigarette butts and packets), Cups (e.g.,  disposable coffee cups), Plastic straws,  stirrers,  cutlery, Sewage-related items (this could include cotton bud sticks,  feminine hygiene items and others disposed of via toilets), Polystyrene itemsOtherMicroplastics that result from degradation of macroplastics (secondary microplastics)Food & Beverages, Retail, Wastewater/Sewage management763942USD0USDPublic FinancingU.S. EPA; Mexico's SEMARNAT; Canada's Environment and Climate Change Canada (ECCC)Continuous activity 1-3 Yearshttp://www.cec.org/our-work/projects/building-community-solutions-marine-litter2020-01-30 18:37:04 UTC2020-01-30 19:57:02 UTC
First Phase545728-545719-54549024YESYESYESFinnish Environment InstituteOn behalf of an organisationFinnish Environment InstituteNo,  I am returning to the survey to report on additional actions/activitiesTEKONURMI (Artificial turf)This is a project aiming at identifying the emmission points and pathways of the infill from different football fields MONITORING and ANALYSIS: Collecting evidence around plastic discharge to the ocean/waterways? (e.g. monitoring,  analysis)OtherSoil,  small waterways,  stormwaters,  snow,  shoes,  equipments  and other relevant pathways will be investigatedIt is freely available and open sourceThe project has recently started,  we do not yet have a websiteLEGISLATION,  STANDARDS,  RULES: e.g. agreeing new or changing rules or standards that others should comply with,  new regulation,  agreements,  policies,  economic instruments etc. including voluntary commitments, WORKING WITH PEOPLE: Encouraging or enabling others (e.g.,  education,  training,  communication,  awareness raising,  behaviour change programmes)DeveloperOtherOur institute (governmental) + a engineering conmpany + finnish football associationYesThere is a mandatory reporting mechanismYesNational FinlandUrban environment, Coastal zoneNot applicableNot ApplicableHuman health and wellbeing, Biodiversity, Marine organisms, Food chain, Economics and TradeMacroplastic (large,  more than 20 mm,  e.g. plastic bottles), Microplastics (tiny plastic particles less than 5 mm in diameter,  e.g.,  found in personal care products/synthetic textiles)OtherSBR rubber of various sizesOtherSBR rubber of various sizesNot applicable111607USD11161USDPublic FinancingMinistry of Culture and EducationContinuous activity 1-3 Years2020-01-30 20:51:20 UTC2020-01-30 21:10:21 UTC
First Phase545728-545719-54483432YESYESYESnot applicableOn behalf of an organisationMinistry of the EnvironmentNo,  I am returning to the survey to report on additional actions/activitiesEnvironmental Education Campaign Using the Micro Theater and Puppet Works as Communication Tools1. Park ranger training in theatre and communication techniques  2. Elaboration of costumes,  puppets and theatres.  3. Presentation of works with topics related to marine litter on the beach to tourists  4. Presentation of works with topics related to marine litter in schools and colleges  5. Presentation of works with topics related to marine litter to the community in generalWORKING WITH PEOPLE: Encouraging or enabling others (e.g.,  education,  training,  communication,  awareness raising,  behaviour change programmesAwareness raising and Behaviour change, Education/Training, WorkshopsInformation campaign, Behaviour change campaign/programme, Community Engagement, Creative/arts event; exhibitionProfessional skills training, Other training programmes, Institutional developmentImplementerPUBLIC ADMINISTRATION (organisations concerned with government policies and programmes)National ministry/agencyYesThere is a mandatory reporting mechanismNoSub-national EcuadorForests or Mangroves, Urban environment, Coastal zone, Maritime area within national jurisdiction, Areas beyond national jurisdictionUse / consumption, Collection / sorting of plastics after useReducing plastics, Reusing plastic, Recycling plasticsHuman health and wellbeing, Biodiversity, Marine organisms, Ecosystem ServicesMacroplastic (large,  more than 20 mm,  e.g. plastic bottles)Bottles, Plastic bags, Food packaging (containers, wrappers etc.), Non-food packaging (containers, wrappers etc.), Smoking related litter (cigarette butts and packets), Fishing related items, Shipping related items, Cups (e.g., disposable coffee cups), Plastic straws, stirrers, cutlery, Sewage-related items (this could include cotton bud sticks, feminine hygiene items and others disposed of via toilets), Natural disaster/hazard related debris Polystyrene itemsTourism, OtherSchools,  colleges16000USD5000USDPublic Financing, Private Sector1. Ministry of Environment  2. Coca Cola Fundation  3. Deutsche Gesellschaft für Internationale Zusammenarbeit   4. International Conservation FoundationContinuous activity more than 3 Years long2020-01-29 18:43:14 UTC2020-01-30 21:17:08 UTC
First Phase545728-545719-54546348YESYESYESMinistry of Environment and Sustainable Development of ColombiaOn behalf of an organisationMinistry of Environment and Sustainable Development of ColombiaYes3Follow-up of the Impact of Tax on Plastic Bags and the Implementation of Resolution 668 of 2016Reduction of 53% in the consumption of plastic bags in retailers (From 1, 227 million bags to 570 million in 2 years) due to the implementation of the plastic bag tax and Resolution 668 of 2016LEGISLATION,  STANDARDS,  RULES: e.g. agreeing new or changing rules or standards that others should comply with,  new regulation,  agreements,  policies,  economic instruments etc. including voluntary commitments.Legislation or regulations, Change in Taxes/SubsidiesDeveloperPRIVATE SECTOR ORGANISATION (for-profit organisations run by individuals and groups,  free from government ownership).Multinational Corporation, National Corporation, Small-medium sized enterpriseYesThere is a mandatory reporting mechanismYesNational ColombiaUrban environmentDesign, Use / consumptionReducing plasticsBiodiversity, Ecosystem Services, Economics and TradeMacroplastic (large,  more than 20 mm,  e.g. plastic bottles)Plastic bagsRetail97058USDPublic FinancingPublic resources for follow-up and controlContinuous activity 1-3 Yearshttp://vital.anla.gov.co/SILPA/TESTSILPA/Security/Login.aspx2020-01-30 19:50:11 UTC2020-01-30 21:35:33 UTC
First Phase545728-545719-54550817YESYESYESMinistry of Environment and Sustainable Development of ColombiaOn behalf of an organisationMinistry of Environment and Sustainable Development of ColombiaNo,  I am returning to the survey to report on additional actions/activitiesFormulation of the National Plan for the Sustainable Management of Single-Use PlasticsFormulation along with the main stakeholders of a plan which includes:  - Substitution of single-use plastic products  -  Establishment of Extended Producer Responsibility (EPR)  - Establishment of Communication and Citizen Culture program   - Articulation of the productive chain LEGISLATION,  STANDARDS,  RULES: e.g. agreeing new or changing rules or standards that others should comply with,  new regulation,  agreements,  policies,  economic instruments etc. including voluntary commitments.Official agreements, Policy change or development, High-level strategy, Legislation or regulations, Voluntary commitments, New standard(s) or guideline(s), Ban(s)WORKING WITH PEOPLE: Encouraging or enabling others (e.g.,  education,  training,  communication,  awareness raising,  behaviour change programmes)DeveloperPUBLIC ADMINISTRATION (organisations concerned with government policies and programmes), PRIVATE SECTOR ORGANISATION (for-profit organisations run by individuals and groups,  free from government ownership)., THIRD SECTOR (e.g. non-governmental and non-profit-making organisations,  including charity groups,  community groups etc).National ministry/agency, Sub-national ministry/agencyMultinational Corporation, National Corporation, Small-medium sized enterpriseNon-governmental organisation, Community based organisation, Educational sectorYesThere is a mandatory reporting mechanismYesNational ColombiaMountains and upland area, Agricultural land/soils, Entire water catchment, Forests or Mangroves, Freshwater rivers and lakes, Urban environment, Waste disposal sites, Coastal zone, Maritime area within national jurisdiction, Open ocean and high seasRaw materials, Design, Production / Manufacture, Use / consumption, Collection / sorting of plastics after use, Management of collected plastics, Clean-up of plastic from the environmentReducing plastics, Reusing plastic, Recycling plasticsBiodiversity, Marine organisms, Ecosystem Services, Food chain, Economics and TradeMacroplastic (large,  more than 20 mm,  e.g. plastic bottles), Microplastics (tiny plastic particles less than 5 mm in diameter,  e.g.,  found in personal care products/synthetic textiles), Additives incorporated into plastic itemsBottles, Plastic bags, Food packaging (containers,  wrappers etc.), Non-food packaging (containers,  wrappers etc.), Smoking related litter (cigarette butts and packets), Shipping related items, Cups (e.g.,  disposable coffee cups), Plastic straws,  stirrers,  cutlery, Sewage-related items (this could include cotton bud sticks,  feminine hygiene items and others disposed of via toilets), Polystyrene itemsMicrobeads used in cosmetics, Microplastics used in other products e.g. paints 

Packaging, Textiles, Transportation, Building, Construction, Demolition Industrial Machinery, Automotive, Electrical and Electronics Agriculture, Fisheries, Aquaculture, Food & Beverages, Personal Healthcare, Medical, Retail, Tourism, Wastewater/Sewage management 60661USD11161USDVoluntary donations, Public FinancingSalaries of work group in the Ministry  Technical assistance by the European UnionContinuous activity more than 3 Years longhttps://www.minambiente.gov.co/2020-01-30 21:36:37 UTC2020-01-30 22:08:25 UTC
First Phase545728-545719-54551999YESYESYESMinistry of Environment and Sustainable  Development of ColombiaOn behalf of an organisationMinistry of Environment and Sustainable  Development of ColombiaNo,  I am returning to the survey to report on additional actions/activitiesEstablishment of Extended Producer Responsability for Packaging WasteEstablishment of a legislation that imposes extender producer responsibility for the management of packaging waste generated by the commercialized products in the countryLEGISLATION,  STANDARDS,  RULES: e.g. agreeing new or changing rules or standards that others should comply with,  new regulation,  agreements,  policies,  economic instruments etc. including voluntary commitments.Policy change or development, Legislation or regulationsDeveloperPRIVATE SECTOR ORGANISATION (for-profit organisations run by individuals and groups,  free from government ownership).Multinational Corporation, National Corporation, Small-medium sized enterpriseYesThere is a mandatory reporting mechanismYesNational ColombiaMountains and upland area, Agricultural land/soils, Entire water catchment, Forests or Mangroves, Freshwater rivers and lakes, Urban environment, Waste disposal sites, Coastal zone, Maritime area within national jurisdictionRaw materials, Design, Production / Manufacture, Use / consumption, Collection / sorting of plastics after use, Management of collected plasticsReducing plastics, Reusing plastic, Recycling plasticsBiodiversity, Marine organisms, Ecosystem Services, Food chain, Economics and TradeMacroplastic (large,  more than 20 mm,  e.g. plastic bottles)Bottles, Plastic bags, Food packaging (containers,  wrappers etc.), Non-food packaging (containers,  wrappers etc.), Shipping related items, Cups (e.g.,  disposable coffee cups), Polystyrene itemsPackaging, Textiles, Transportation, Building, Construction, Demolition Industrial Machinery, Automotive, Electrical and Electronics Agriculture, Fisheries, Aquaculture, Food & Beverages, Personal Healthcare, Medical, Retail, Tourism, Wastewater/Sewage management 121322USDPublic FinancingSalaries of work group in the ministryContinuous activity more than 3 Years longhttps://www.minambiente.gov.co/2020-01-30 22:10:09 UTC2020-01-30 22:44:20 UTC
First Phase545728-545719-54555559YESYESYESCalifornia Ocean Protection Council On behalf of an organisationCalifornia Ocean Protection CouncilNo,  I am returning to the survey to report on additional actions/activitiesLegislation: Senate Bill 1263,  Microplastics StrategyA law requiring the development of a statewide microplastics strategy to address microplastics in California's marine environment.MONITORING and ANALYSIS: Collecting evidence around plastic discharge to the ocean/waterways? (e.g. monitoring,  analysis)Review and synthesis :Environmental, OtherThe microplastic strategy includes the development of standardized methods for identifying and characterizing microplastic,  development of a risk assessment framework for microplastics in the marine environment,  a prioritized research plan,  and recommendations for policy changes to prevent microplastics from entering the environment.It is freely available and open sourceWe're in the early stages of developing the Strategy,  so data is not currently available. When we collect data,  we require it to be made available on the California Natural Resources Agency's Open Data Portal.ImplementerPUBLIC ADMINISTRATION (organisations concerned with government policies and programmes)Sub-national ministry/agencyYesThere is a mandatory reporting mechanismNoSub-national United States of AmericaEntire water catchment, Coastal zone, OtherCoastal and Marine area within State jurisdictionNot applicableNot Applicable, OtherThis action targets gathering necessary information to develop policy on microplasticsHuman health and wellbeing, Biodiversity, Marine organisms, Food chainMicroplastics (tiny plastic particles less than 5 mm in diameter,  e.g.,  found in personal care products/synthetic textiles)Microbeads used in cosmetics, Microplastics used in other products e.g. paints 

Packaging, Textiles, Transportation, Building, Construction, Demolition Industrial Machinery, Automotive, Electrical and Electronics Agriculture, Fisheries, Aquaculture, Food & Beverages, Personal Healthcare, Medical, Retail, Tourism, Wastewater/Sewage management Single eventhttps://leginfo.legislature.ca.gov/faces/billTextClient.xhtml?bill_id=201720180SB12632020-01-31 00:10:22 UTC2020-01-31 00:50:06 UTC
First Phase545728-545719-54556218YESYESYESCalifornia Ocean Protection CouncilOn behalf of an organisationCalifornia Ocean Protection CouncilNo,  I am returning to the survey to report on additional actions/activitiesCalifornia Ocean Litter Prevention StrategyA high-level strategy document outlining actions the State and stakeholders can take to address ocean litter.LEGISLATION,  STANDARDS,  RULES: e.g. agreeing new or changing rules or standards that others should comply with,  new regulation,  agreements,  policies,  economic instruments etc. including voluntary commitments.High-level strategyWORKING WITH PEOPLE: Encouraging or enabling others (e.g.,  education,  training,  communication,  awareness raising,  behaviour change programmes)DeveloperPUBLIC ADMINISTRATION (organisations concerned with government policies and programmes), PRIVATE SECTOR ORGANISATION (for-profit organisations run by individuals and groups,  free from government ownership)., THIRD SECTOR (e.g. non-governmental and non-profit-making organisations,  including charity groups,  community groups etc).Sub-national ministry/agencyMultinational Corporation, National Corporation, Small-medium sized enterpriseNon-governmental organisation, Community based organisation, Educational sectorNoThere is no reporting mechanismYesSub-national United States of AmericaEntire water catchment, Coastal zoneDesign, Production / Manufacture, Use / consumption, Collection / sorting of plastics after use, Management of collected plastics, Clean-up of plastic from the environmentReducing plastics, Reusing plastic, Recycling plasticsHuman health and wellbeing, Biodiversity, Marine organisms, Ecosystem Services, Food chain, Economics and TradeMacroplastic (large,  more than 20 mm,  e.g. plastic bottles), Microplastics (tiny plastic particles less than 5 mm in diameter,  e.g.,  found in personal care products/synthetic textiles), Additives incorporated into plastic itemsBottles, Plastic bags, Food packaging (containers,  wrappers etc.), Non-food packaging (containers,  wrappers etc.), Smoking related litter (cigarette butts and packets), Fishing related items, Cups (e.g.,  disposable coffee cups), Plastic straws,  stirrers,  cutlery, Polystyrene itemsMicrobeads used in cosmetics, Microplastics used in other products e.g. paints 

Packaging, Textiles, Agriculture, Fisheries, Food & Beverages, Retail, Wastewater/Sewage managementPublic FinancingContinuous activity more than 3 Years longhttp://www.opc.ca.gov/programs-summary/marine-pollution/oceanlitterstrategyproject/http://www.opc.ca.gov/webmaster/_media_library/2018/06/2018_CA_OceanLitterStrategy.pdf2020-01-31 00:50:22 UTC2020-01-31 01:22:31 UTC
First Phase545728-545719-53724709YESYESYESMinistry of the Environment,  JapanOn behalf of an organisationMinistry of the Environment,  JapanNo,  I am returning to the survey to report on additional actions/activitiesAwareness Raising and Collaboration with ActorsTo solve marine plastic issues,  Japan promotes the “Plastics Smart” campaign. This has been actively promoted,  encouraging cooperation and collaboration among a wide range of stakeholders,  such as national,  local public organizations,  citizens,  NGOs,  businesses,  and research institutes. Plastics Smart promotes “the wise use of plastics” to prevent the generation of marine litter.   Clean Ocean Material Alliance: It has become necessary for society to promote worldwide efforts to overcome the marine plastic litter issue,  a newly emerging global challenge. To decrease such litter,  conducting appropriate control of waste is urgently needed,  including through thorough efforts for preventing littering,  further enhancement of the 3Rs (Reduce,  Reuse and Recycle) initiatives involving plastic products,  and further development and adoption of plastics with excellent biodegradability and materials alternative to plastics,  for e.g.,  paper.  We established the Japan Clean Ocean Material Alliance consisting of a wide range of business operators that make up the supply chain and work actively in order to accelerate innovation through public-private partnerships by promoting the 3Rs new efforts and alternative materials that make the use of plastic products more sustainable.WORKING WITH PEOPLE: Encouraging or enabling others (e.g.,  education,  training,  communication,  awareness raising,  behaviour change programmesAwareness raising and Behaviour changeInformation campaign, Behaviour change campaign/programme, Community Engagement, Stakeholder Engagement, Citizen Science, Creative/arts event; exhibitionTECHNOLOGY and PROCESSES: New technical developments/innovation (e.g.,  research and development,  new product design,  new materials,  processes etc.),  changes in practice,  operations,  environmental management and planningImplementerPUBLIC ADMINISTRATION (organisations concerned with government policies and programmes), PRIVATE SECTOR ORGANISATION (for-profit organisations run by individuals and groups,  free from government ownership)., THIRD SECTOR (e.g. non-governmental and non-profit-making organisations,  including charity groups,  community groups etc).National ministry/agency, Sub-national ministry/agencyMultinational Corporation, National Corporation, Small-medium sized enterpriseNon-governmental organisation, Community based organisation, Educational sectorYesReporting is voluntaryYesNational JapanNot applicableRaw materials, Design, Production / Manufacture, Use / consumption, Collection / sorting of plastics after use, Management of collected plastics, Clean-up of plastic from the environmentReducing plastics, Reusing plastic, Recycling plasticsNot applicableMacroplastic (large,  more than 20 mm,  e.g. plastic bottles), Microplastics (tiny plastic particles less than 5 mm in diameter,  e.g.,  found in personal care products/synthetic textiles)Bottles, Plastic bags, Food packaging (containers, wrappers etc.), Non-food packaging (containers, wrappers etc.), Smoking related litter (cigarette butts and packets), Fishing related items, Shipping related items, Cups (e.g., disposable coffee cups), Plastic straws, stirrers, cutlery, Sewage-related items (this could include cotton bud sticks, feminine hygiene items and others disposed of via toilets), Natural disaster/hazard related debris Polystyrene itemsMicrobeads used in cosmetics, Microplastics used in other products e.g. paints 

Packaging, Textiles, Transportation, Building, Construction, Demolition Industrial Machinery, Automotive, Electrical and Electronics Agriculture, Fisheries, Aquaculture, Food & Beverages, Personal Healthcare, Medical, Retail, Tourism, Wastewater/Sewage management 1918334USDPublic Financing, Private SectorFY2019 national budget (related to "Plastics Smart". Ministry of the Environment,  Japan)Continuous activity 1-3 Yearshttp://plastics-smart.env.go.jp/en/https://cloma.net/english/2020-01-10 02:39:17 UTC2020-01-31 01:25:28 UTC
First Phase545728-545719-54557524YESYESYESCalifornia Ocean Protection CouncilOn behalf of an organisationCalifornia Ocean Protection CouncilNo,  I am returning to the survey to report on additional actions/activitiesTrash Amendments to Water Quality Control PlansRegulations that prohibit the discharge of trash to state waters from stormwater systems.LEGISLATION,  STANDARDS,  RULES: e.g. agreeing new or changing rules or standards that others should comply with,  new regulation,  agreements,  policies,  economic instruments etc. including voluntary commitments.Legislation or regulationsTECHNOLOGY and PROCESSES: New technical developments/innovation (e.g.,  research and development,  new product design,  new materials,  processes etc.),  changes in practice,  operations,  environmental management and planning, MONITORING and ANALYSIS: Collecting evidence around plastic discharge to the ocean/waterways? (e.g. monitoring,  analysis)SubmitterPUBLIC ADMINISTRATION (organisations concerned with government policies and programmes)Sub-national ministry/agencyNoThere is no reporting mechanismYesSub-national United States of AmericaEntire water catchment, Urban environmentClean-up of plastic from the environmentNot ApplicableMarine organismsMacroplastic (large,  more than 20 mm,  e.g. plastic bottles)Bottles, Plastic bags, Food packaging (containers,  wrappers etc.), Non-food packaging (containers,  wrappers etc.), Smoking related litter (cigarette butts and packets), Cups (e.g.,  disposable coffee cups), Plastic straws,  stirrers,  cutlery, Polystyrene itemsOtherStormwater Agencies/Stormwater ManagementPublic FinancingContinuous activity more than 3 Years longhttps://www.waterboards.ca.gov/water_issues/programs/trash_control/https://www.waterboards.ca.gov/water_issues/programs/stormwater/trash_implementation.htmlhttp://www.opc.ca.gov/programs-summary/marine-pollution/plastics/trash-monitoring/https://sites.google.com/sfei.org/trash/home2020-01-31 02:52:54 UTC2020-01-31 03:11:22 UTC
