When submitted?,Unique Response Number,Introduction,"1. I agree to share the information provided in this survey. (Note we will not share your name, role or email address).",2. I will provide the answers that reflect the best of my knowledge and facts available to me.,"3. I have received adequate information about the survey and about my ethical rights as a participant, including my right to withdraw. I consent to take part in this research","4.d. Your organisation (If you are not affiliated with an organisation, please write 'not applicable').",5. Are you reporting as an individual or on behalf of an organisation? (Several reports from the same organisation or individual are welcome),"5.a. If you selected Other, please specify:","5.b. On behalf of which organisation are you reporting here? (e.g. UNEP, FAO or name your specific private/public/third sector organisation).",6. Is this the first time that you have completed this survey?,6.a. How many Actions are you intending to tell us about?,7. Please enter a name/title for this action/activity.,"8. Please provide a very short summary of the action/activity (keywords or bullet points are fine, e.g. change to production, deposit return scheme etc.).",9. TYPE OF ACTION: What did the MAIN action/activity focus on? (Please tick ONE which best describes the action you are reporting).,"9.a. You have chosen legislation, standards, rules as the type of action. Specifically, what did the action involve? (Please tick ALL that apply).","9.a.i. If you selected Other, please specify:","9.b. You’ve chosen “working with people” as the type of action. Specifically, what did the action involve? (Please tick ALL that apply):","9.b.i. If you selected Other, please specify:",9.b.ii. Did the awareness raising and behaviour change action/activity involve: (Please tick ALL that apply).,"9.b.ii.a. If you selected Other, please specify:",9.b.iii. Did the Education/Training action/activity involve: (Please tick ALL that apply),"9.b.iii.a. If you selected Other, please specify:",9.b.iii.b. Did the curriculum development involve: (Please tick ALL that apply),"9.b.iii.b.i. If you selected Other, please specify:","9.c. You’ve chosen “technology and processes” as the type of action. Specifically, what did the action involve? (Please tick ALL that apply):","9.c.i. If you selected Other, please specify:",9.c.ii. Did the research and development involve (Please tick ALL that apply):,"9.c.ii.a. If you selected Other, please specify:","9.d. You’ve chosen “monitoring and analysis” as the type of action. Specifically, what did the action involve? (Please tick ALL that apply and if a specific protocol was used, please state it e.g. OSPAR, NOAA, Beachwatch, EU-MSFD, Clean Seas, UNEP, Ocean Conservancy etc.):","9.d.i. If you selected Other, please specify:","9.d.ii. For monitoring on or near ocean surfaces, which programme/protocol did you use?","9.d.iii. For monitoring of the water column, which programme/protocol did you use?","9.d.iv. For monitoring on the seafloor, which programme/protocol did you use?","9.d.v. For monitoring on the shoreline, which programme/protocol did you use?","9.d.vi. For monitoring in Biota, which programme/protocol did you use?","9.d.vii. For air monitoring, which programme/protocol did you use?",9.d.viii. How can the data and information from your monitoring programme be accessed?,"9.d.viii.a. If the monitoring data is available on request, please provide information on how to access the data?",9.d.viii.b. Please provide the URL's for any links to the monitoring data and information.,"10. TYPE OF ACTION: Whilst you already selected the focus of your action/activity in Question 9, did the action/activity also involve other aspects (please tick which ones below):",11. What is the organisation's role regarding this action: [ACTION],"11.a. If you selected Other, please specify:",12. Who is responsible for the action implementation?,"12.a. If you selected Other, please specify:",12.b. Is the Public Administration body a........,"12.b.i. If you selected Other, please specify:",12.c. Is the Private sector organisation a........,"12.c.i. If you selected Other, please specify:",12.d. Is the third sector organisation a......,"12.d.i. If you selected Other, please specify:",13. Reporting and evaluations: Do you report on the action?,13.a. You answered that you do report on the action. Is this because:,"13.a.i. If you selected Other, please specify:",13.b. You answered that you do not report on the action. Is this because:,"13.b.i. If you selected Other, please specify:",14. Are the actual outcomes and impacts of the action evaluated?,"14.a. If you selected Other, please specify:",15. What’s the geographical focus of the action?,"15.a. If you selected Other, please specify:",16. In which member state(s) does the action take place?,"16.a. If you selected Other, please specify:",17. Which specific place or area is your action targeting? (Please tick all that apply),"17.a. If you selected Other, please specify:",18. Which specific part of the lifecycle/plastic supply chain is your action targeting? (Please tick all that apply),"18.a. If you selected Other, please specify:",19. Does your action target the following? (Please tick all that apply),"19.a. If you selected Other, please specify:",20. What impacts or harms does the action relate to? (Please tick all that apply),"20.a. If you selected Other, please specify:",21. What types of items or contaminants does the action target?,"21.a. If you selected Other, please specify:",21.b. What type of macroplastic contaminant does the action target? (Please tick all that apply),"21.b.i. If you selected Other, please specify:",21.c. What type of microplastic contaminant does the action target?,"21.c.i. If you selected Other, please specify:",22. Does your action target a specific sector? (Please tick all that apply),"22.a. If you selected Other, please specify:","23. How much money (amount) has been invested in the action so far? (please give us an estimate if you’re unsure and only submit numbers, e.g, 5,000 should be entered as 5000)",24. Please specify the currency.,"25. Are there in kind contributions as well? (Please tell us the equivalent amount and only submit numbers, e.g, 5,000 should be entered as 5000).",26. Please specify the currency,27. What funding sources did you use?,"27.a. If you selected Other, please specify:",27.b. Please name the specific source(s) of funding?,28. Is your action a one-off activity or continuous?,"28.a. If you selected Other, please specify:","29. In the boxes below, please provide i.e. copy and paste links, URL's, website links etc to documents about your action. We are interested in websites, reports, images, media articles etc. Please place only one link per box provided. If you have no documents to share, please write 'I have no links to provide' in the first box. You can also email documents and images - as attachments - to marinelitterstocktake@plymouth.ac.uk",29.a. Another Link,29.b. Another link to information:,29.c. Another link to information,29.d. Another link to information,29.e. Another link to information,30. Is there anything more that you would like to tell us about your action/activity? Please use the box below.,StartDate,CompletionDateFirst Phase,545728-545719-53376637,,YES,YES,YES,The SeaCleaners,On behalf of an organisation,,The SeaCleaners,Yes,4,AWARENESS RAISING,#NAME?,"WORKING WITH PEOPLE: Encouraging or enabling others (e.g., education, training, communication, awareness raising, behaviour change programmes",,,"Awareness raising and Behaviour change,Education/Training,Workshops,Conferences",,"Information campaign,Behaviour change campaign/programme,Community Engagement,Stakeholder Engagement",,"Professional skills training,Institutional development",,,,,,,,,,,,,,,,,,,,I/We are implementing it,,"THIRD SECTOR (e.g. non-governmental and non-profit-making organisations, including charity groups, community groups etc).",,,,,,Non-governmental organisation,,No,,,There is not enough resource to support reporting,,No,,"Transnational (several countries are involved, including bilateral)",,"France,Germany,Indonesia,Switzerland",,"Coastal zone,Maritime area within national jurisdiction,Areas beyond national jurisdiction,Open ocean and high seas",,"Raw materials,Design,Production / Manufacture,Use / consumption,Collection / sorting of plastics after use,Management of collected plastics,Clean-up of plastic from the environment",,"Reducing plastics,Reusing plastic,Recycling plastics",,"Human health and wellbeing,Biodiversity,Marine organisms,Ecosystem Services,Food chain,Economics and Trade",,"Macroplastic (large, more than 20 mm, e.g. plastic bottles)",,All of the above,,,,All of the above,,334821.4286,USD,558035.7143,USD,"Voluntary donations,Private Sector",,private sponsorship,Continuous activity 1-3 Years,,https://www.theseacleaners.org/en/educational-hub/,,,,,,,2019-12-20 17:36:36 UTC,2019-12-30 15:42:40 UTCFirst Phase,545728-545719-53649934,,YES,YES,YES,The Institute of Environmental Science and Research,As an individual,,,Yes,4,New Zealand Plastic bag ban,Government ban of the use of single-use plastic bags in New Zealand. ,"LEGISLATION, STANDARDS, RULES: e.g. agreeing new or changing rules or standards that others should comply with, new regulation, agreements, policies, economic instruments etc. including voluntary commitments.","Official agreements,Policy change or development,Legislation or regulations,Ban(s)",,,,,,,,,,,,,,,,,,,,,,,,,"WORKING WITH PEOPLE: Encouraging or enabling others (e.g., education, training, communication, awareness raising, behaviour change programmes)",We are only reporting it here,,"PUBLIC ADMINISTRATION (organisations concerned with government policies and programmes),PRIVATE SECTOR ORGANISATION (for-profit organisations run by individuals and groups, free from government ownership).",,National ministry/agency,,"National Corporation,Small-medium sized enterprise",,,,No,,,Other,I am not involved in the process,Other,results of the ban are being indirectly monitored by other initiatives ,National (it covers one entire country),,Other,New Zealand,All of the above,,Use / consumption,,Reducing plastics,,All of the above,,"Macroplastic (large, more than 20 mm, e.g. plastic bottles)",,Plastic bags,,,,Retail,,,,,,Not applicable,,,Continuous activity more than 3 Years long,,https://www.mfe.govt.nz/waste/single-use-plastic-shopping-bags-banned-new-zealand,,,,,,,2020-01-07 22:32:59 UTC,2020-01-07 23:05:20 UTCFirst Phase,545728-545719-53668499,,YES,YES,YES,"Secretariat of the Basel, Rotterdam and Stockholm Conventions",On behalf of an organisation,,"Secretariat of the Basel, Rotterdam and Stockholm Conventions",Yes,3,Updating the technical guidelines for the identification and environmentally sound management of plastic wastes and for their disposal,"At its sixth meeting held in December 2002, the Conference of the Parties (COP) to the Basel Convention adopted the technical guidelines for the identification and environmentally sound management (ESM) of plastic wastes and for their disposal. At its fourteenth meeting held in May 2019, in its decision BC-14/13, the COP decided to update the technical guidelines on plastic wastes and established a small intersessional working group. The group is led by China, Japan and the United Kingdom of Great Britain and Northern Ireland and consists of experts nominated by Parties and others. The group will prepare draft updated technical guidelines for consideration at the twelfth meeting of the Open-ended Working Group of the Basel Convention to be held in June 2020. A further revised version will then be considered at the fifteenth meeting of the COP to be held in May 2021 for possible adoption.  The technical guidelines include the following:  • Sources of plastic waste (pre-user and post-user)  • Environmentally sound and safe handling, compaction, transport, storage and shipping of plastic waste  • Health and safety issues  • Fire safety  • Second life applications for plastics material  • Energy recovery from plastic waste  • Final disposal of plastic waste  • Technical guidelines on the environmentally sound management of plastic-coated cables scrap  ","LEGISLATION, STANDARDS, RULES: e.g. agreeing new or changing rules or standards that others should comply with, new regulation, agreements, policies, economic instruments etc. including voluntary commitments.","Policy change or development,New standard(s) or guideline(s)",,,,,,,,,,,,,,,,,,,,,,,,,"TECHNOLOGY and PROCESSES: New technical developments/innovation (e.g., research and development, new product design, new materials, processes etc.), changes in practice, operations, environmental management and planning",Other,We are the supporting Parties and others to update the technical guidelines as the Secretariat of the Basel Convention and requested by the COP decision.,"PUBLIC ADMINISTRATION (organisations concerned with government policies and programmes),PRIVATE SECTOR ORGANISATION (for-profit organisations run by individuals and groups, free from government ownership).,THIRD SECTOR (e.g. non-governmental and non-profit-making organisations, including charity groups, community groups etc).,Other","The technical guidelines if adopted at the COP of the Basel Convention will become a reference standard agreed at the international level for the environmentally sound management of plastic wastes, but it is not mandatory to any stakeholder to follow it. ","International body,National ministry/agency,Sub-national ministry/agency",,"Multinational Corporation,National Corporation,Small-medium sized enterprise",,"Non-governmental organisation,Community based organisation,Educational sector",,Yes,There is a mandatory reporting mechanism,,,,No,,Global (it covers the whole world),,All,,All of the above,,"Collection / sorting of plastics after use,Management of collected plastics",,"Reducing plastics,Recycling plastics",,Human health and wellbeing,,"Macroplastic (large, more than 20 mm, e.g. plastic bottles),Microplastics (tiny plastic particles less than 5 mm in diameter, e.g., found in personal care products/synthetic textiles),Additives incorporated into plastic items",,All of the above,,All of the above,,All of the above,,,,10000,USD,Other,"Staff time, IT resources for online meetings",Core funds of the convention,Continuous activity 1-3 Years,,http://www.basel.int/Implementation/Plasticwastes/Technicalguidelines/Overview/tabid/7992/Default.aspx,,,,,,,2020-01-08 13:54:19 UTC,2020-01-10 15:05:07 UTCFirst Phase,545728-545719-53741002,,YES,YES,YES,Dirección del Parque Nacional Galápagos,On behalf of an organisation,,Dirección del Parque Nacional Galápagos,Yes,1,LIMPIEZA COSTERA EN GALÁPAGOS,"Se realizan viajes en diferentes embarcaciones alrededor de las islas Galápagos, llegando a sitios no turísticos, en los cuales se ha evidenciado la basura plástica marina, se recolecta y clasifica de acuerdo a su tipo y procedencia. Además de realizar actividades y monitoreos con microplásticos.","WORKING WITH PEOPLE: Encouraging or enabling others (e.g., education, training, communication, awareness raising, behaviour change programmes",,,Other,Limpieza y recolección de basura plástica marina y microplásticos,,,,,,,,,,,,,,,,,,,,,,"MONITORING and ANALYSIS: Collecting evidence around plastic discharge to the ocean/waterways? (e.g. monitoring, analysis)",I/We developed it,,PUBLIC ADMINISTRATION (organisations concerned with government policies and programmes),,National ministry/agency,,,,,,Yes,There is a mandatory reporting mechanism,,,,Yes,,Sub-national (it covers parts of one country),,Ecuador,,Coastal zone,,"Management of collected plastics,Clean-up of plastic from the environment",,Reducing plastics,,"Biodiversity,Marine organisms,Ecosystem Services,Food chain",,"Macroplastic (large, more than 20 mm, e.g. plastic bottles),Microplastics (tiny plastic particles less than 5 mm in diameter, e.g., found in personal care products/synthetic textiles)",,"Bottles,Plastic bags,Food packaging (containers, wrappers etc.),Fishing related items,Plastic straws, stirrers, cutlery,Polystyrene items",,Other,Pellets,"Fisheries,Food & Beverages",,50000,USD,50000,USD,"Public Financing,Private Sector",,Fondos Coca Cola,Continuous activity more than 3 Years long,,http://www.galapagos.gob.ec/46-toneladas-de-basura-fueron-retiradas-de-las-costas-de-galapagos/,http://www.ambiente.gob.ec/limpieza-costera-unio-comunidad-e-instituciones-en-galapagos/,http://www.galapagos.gob.ec/galapagos-se-sumo-a-la-iniciativa-accion-por-el-planeta/,https://conservation.org.ec/boletines/iniciativa-limpieza-costera-retiro-2-5-toneladas-en-primer-viaje-a-sitios-remotos-de-galapagos/?frame=0,,,,2020-01-10 14:06:52 UTC,2020-01-10 16:21:59 UTCFirst Phase,545728-545719-53853866,,YES,YES,YES,"Institute of Oceanography and Fisheries, Split, Croatia. ",As an individual,,,Yes,1,Fishing for litter,"Fisheries is a sector that can make a significant contribution to solving the problem of the marine litter, by participating in its removal through the ""Fishing for Litter"" (FfL) initiative. This practice relates to the collection of litter from the sea that are caught in the nets during the fishing and its disposal on the shore in communal containers where it is handled within the existing waste management system without reimbursement for fishermen. This report presents the experiences and achievements of the EU ML-REPAIR project in the Croatia that could be used to further develop the litter accumulated on sea bottom disposal initiative in the Croatian part of the Adriatic. One of the project goals is to design new strategies to reduce the marine litter quantities in the Adriatic Sea. Project activities were conceived through the cross-border cooperation of partners from the INTEREG ITA-CRO dealing with the problem of marine litter removing by involving the fisheries sector. These initiatives on the Croatian side of the Adriatic Sea are managed and coordinated by the Institute for Oceanography and Fisheries (IZOR) from Split, one of the partners in the project. The initiative was a reflection of the operational methods of pilot-programs implemented in Western European countries (the Netherlands, Denmark, Sweden and the United Kingdom) based on the experiences of KIMO Networks participating in such programs, such as Fishing-for-Litter Scotland.","WORKING WITH PEOPLE: Encouraging or enabling others (e.g., education, training, communication, awareness raising, behaviour change programmes",,,"Awareness raising and Behaviour change,Education/Training,Workshops",,"Information campaign,Behaviour change campaign/programme,Community Engagement,Stakeholder Engagement",,"Other training programmes,Institutional development",,,,,,,,,,,,,,,,,,,"LEGISLATION, STANDARDS, RULES: e.g. agreeing new or changing rules or standards that others should comply with, new regulation, agreements, policies, economic instruments etc. including voluntary commitments,MONITORING and ANALYSIS: Collecting evidence around plastic discharge to the ocean/waterways? (e.g. monitoring, analysis)",I/We are implementing it,,PUBLIC ADMINISTRATION (organisations concerned with government policies and programmes),,Sub-national ministry/agency,,,,,,Yes,Reporting is voluntary,,,,Yes,,National (it covers one entire country),,Croatia,,Maritime area within national jurisdiction,,All of the above,,Reducing plastics,,"Human health and wellbeing,Biodiversity,Marine organisms,Ecosystem Services,Food chain,Economics and Trade",,"Macroplastic (large, more than 20 mm, e.g. plastic bottles)",,All of the above,,,,All of the above,,55803.57143,USD,,,Other,European Union funds through InterReg project,Interreg funding,Continuous activity 1-3 Years,,http://www.ml-repair.eu/en,http://www.defishgear.net/desert2/itemlist/tag/fishing%20for%20litter,https://www.jutarnji.hr/vijesti/hrvatska/alarm-na-jadranu-uskoro-bi-u-njemu-moglo-biti-vise-plastike-nego-ribe-stigli-zapanjujuci-podaci-o-otpadu-evo-koje-proizvode-najvise-bacamo-u-more/8182376/,https://net.hr/danas/hrvatska/ponosni-ste-na-predivan-i-cist-jadran-velika-je-to-zabluda-jadransko-more-je-medu-najazagadenijima-u-europi-razlog-stvarno-ljuti/,http://www.ml-repair.eu/attachment/preview/5dc978067a693/clanak-1.pdf,https://komunalne-djelatnosti.hr/wp-content/uploads/2019/02/Brosura-Fishing-for-litter.pdf,"Before the DeFishGear project started in 2013, Ffl was unknown practice in the Croatia. One of the aims was to investigate, through the pilot projects, the feasibility of developing this scheme and to prepare guidelines. The implementation in two fishing ports Hvar and Tribunj show a strong fishermen willingness to collaborate, being aware of their unique role in the active removal of litter from the sea. However, due to a lack of an overarching National law addressing marine litter management, its legal status was not defined. Existing Law on Sustainable Waste Management do not specifies how to handle with the litter collected. More should be in a separate regulation that applies only to marine litter, but it has not been adopted to the present days. Thus, marine litter was temporarily classified as urban waste by the hosting Municipalities and the municipal waste management company was in charge of disposal. Ffl activity can be easily implemented in Croatia, but is necessary to improve the legislation about marine litter, to examine deficiencies and gaps in these policies, and suggesting options for improvement.",2020-01-14 12:48:24 UTC,2020-01-14 13:33:37 UTCFirst Phase,545728-545719-53855495,,YES,YES,YES,UNEP,On behalf of an organisation,,UNEP Law Division,Yes,1,"Legislative guidance to countries on marine litter, microplastics and single-use plastics",legislative assistance to countries,"LEGISLATION, STANDARDS, RULES: e.g. agreeing new or changing rules or standards that others should comply with, new regulation, agreements, policies, economic instruments etc. including voluntary commitments.",Legislation or regulations,,,,,,,,,,,,,,,,,,,,,,,,,"WORKING WITH PEOPLE: Encouraging or enabling others (e.g., education, training, communication, awareness raising, behaviour change programmes)",We are the funding body,,PUBLIC ADMINISTRATION (organisations concerned with government policies and programmes),,National ministry/agency,,,,,,Yes,There is a mandatory reporting mechanism,,,,Yes,,Global (it covers the whole world),,"All,Argentina,Mexico",,Other,"lifecycle of plastics (production, distribution, packaging, waste management","All of the above,Other","It depends on the country needs  1) a general global guidance is being developed  2) upon request from countries, there is a gap analysis to identify regulatory gaps so as to provide targeted legal assistance",Other,see comment under Q18,"All of the above,Other",Depends of country needs and priorities,"Macroplastic (large, more than 20 mm, e.g. plastic bottles),Microplastics (tiny plastic particles less than 5 mm in diameter, e.g., found in personal care products/synthetic textiles)",,"All of the above,Other",Depends on country needs and priorities,Other,Depends on country needs and priorities,"Packaging,Textiles,Transportation,Food & Beverages,Personal Healthcare,Wastewater/Sewage management,Other","Mainly the sectors checked, but it depends on country needs and priorities.",150000,USD,50000,USD,Voluntary donations,,,Continuous activity more than 3 Years long,,https://www.unenvironment.org/resources/report/legal-limits-single-use-plastics-and-microplastics,,,,,,#NAME?,2020-01-14 13:15:32 UTC,2020-01-14 14:43:51 UTC