First Phase,545728-545719-54575519,,YES,YES,YES,HELCOM - Baltic Marine Environment  Protection Commission,On behalf of an organisation,,HELCOM - Baltic Marine Environment  Protection Commission,"No, I am returning to the survey to report on additional actions/activities",,FanpLESStic-sea project – Initiatives to remove microplastics before they enter the sea,It is an EU INTERREG Baltic Sea Region project aimed at decreasing and removing microplastics in the Baltic Sea (2019-2021),"TECHNOLOGY and PROCESSES: New technical developments/innovation (e.g., research and development, new product design, new materials, processes etc.) changes in practice, operations, environmental management and planning.",,,,,,,,,,,"Change in practice,Different environmental management of land based environments",,,,,,,,,,,,,,,,Other,It is a project and HELCOM is partner of the project consortium. ,"PRIVATE SECTOR ORGANISATION (for-profit organisations run by individuals and groups, free from government ownership).",,,,Other,Research and development (R&D) company.,,,Yes,There is a mandatory reporting mechanism,,,,Yes,,"Transnational (several countries are involved, including bilateral)",,"Denmark,Finland,Latvia,Lithuania,Norway,Poland,Russian Federation,Sweden",,Other,The Baltic Sea,"Management of collected plastics,Clean-up of plastic from the environment",,Other,Remove microplastics,"Human health and wellbeing,Biodiversity,Marine organisms,Ecosystem Services",,"Microplastics (tiny plastic particles less than 5 mm in diameter, e.g., found in personal care products/synthetic textiles)",,,,All of the above,,"Wastewater/Sewage management,Other",Drinking water plants,3312575.893,USD,0,USD,Other,The Project is co-funded by EU Interreg program. Figure indicated in question 23 is the total budget of the Project.,EU Interreg program,Continuous activity 1-3 Years,,anpLESStic-sea project – Initiatives to remove microplastics before they enter the sea  https://helcom.fi/helcom-at-work/projects/fanplesstic-sea/ Accessed 29 Jan 2020,,,,,,"“FanpLESStic-sea project – Initiatives to remove microplastics before they enter the sea” is an EU INTERREG Baltic Sea Region project aimed at decreasing and removing microplastics in the Baltic Sea (2019-2021). FanpLESStic-sea seeks to reduce microplastic leakage, by providing the following main outputs:   -	A model to map, understand and visualise microplastic pathways that will be applied to the partners’ cities/regions.   -	Piloting of new technology i) for filtering away microplastics; ii) sustainable drainage solutions as means for removal of microplastics; and iii) to remove microplastics from stormwater.   -	Defining innovative governance frameworks and engaging a large range of players for implementation of coordinated and cost-efficient measures resulting in locally adapted investment proposals/plans for each partner’s region.   -	Dissemination of project results, including reports on barriers and ways forward, to increase institutional capacity on up-stream and problem-targeted methods to remove microplastics.   The first output of the project a “Review of existing policies and research related to microplastics” together with an extract of the report more policy oriented (“Policy brief) is now available.",2020-01-31 12:23:19 UTC,2020-01-31 13:09:14 UTCFirst Phase,545728-545719-54576773,,YES,YES,YES,"City of Helsinki, Finland  Environmental protection ",On behalf of an organisation,,"City of Helsinki, Finland  Environmental protection",Yes,1,Baltic Sea Challenge,"The Baltic Sea Challenge (BSC) is a network initiative that invites organisations to commit in protecting the Baltic Sea and their local waters, to building their own Baltic Sea Action Plan and to implementing it. In 2020 there are already about 300 member organisations in the BSC Network from the countries around the Baltic Sea. BSC is run by two big coastal cities in Finland, Helsinki and Turku. In addition to inviting organizations to Baltic Sea protection work, the cities themselves are committed to work for the Baltic Sea. Joint Baltic Sea Action Plan of the cities of Helsinki and Turku 2019-2023 was published last year and it is the third of it's kind. Among the actions there some that especially target marine litter such as organizing annual beach cleaning events in collaborations with the cities of Tallinn and St. Petersburg and local actors. We are also organizing a round of agile experiments that aim to reduce the amount of plastic litter in and around the Baltic Sea.","LEGISLATION, STANDARDS, RULES: e.g. agreeing new or changing rules or standards that others should comply with, new regulation, agreements, policies, economic instruments etc. including voluntary commitments.","Voluntary commitments,New standard(s) or guideline(s)",,,,,,,,,,,,,,,,,,,,,,,,,"TECHNOLOGY and PROCESSES: New technical developments/innovation (e.g., research and development, new product design, new materials, processes etc.), changes in practice, operations, environmental management and planning",I/We are implementing it,,PUBLIC ADMINISTRATION (organisations concerned with government policies and programmes),,Other,City,,,,,Yes,Reporting is voluntary,,,,No,,"Transnational (several countries are involved, including bilateral)",,"Estonia,Finland,Russian Federation,Sweden",,"Urban environment,Coastal zone,Maritime area within national jurisdiction,Areas beyond national jurisdiction",,"Use / consumption,Collection / sorting of plastics after use,Management of collected plastics,Clean-up of plastic from the environment",,"Reducing plastics,Reusing plastic,Recycling plastics",,"Human health and wellbeing,Marine organisms,Ecosystem Services,Food chain",,"Macroplastic (large, more than 20 mm, e.g. plastic bottles),Microplastics (tiny plastic particles less than 5 mm in diameter, e.g., found in personal care products/synthetic textiles)",,All of the above,,All of the above,,Not applicable,,,,,,Public Financing,,,Continuous activity more than 3 Years long,,http://www.itamerihaaste.net/en/about_us,http://www.itamerihaaste.net/files/2087/Baltic_Sea_Action_Plan_Helsinki_Turku_2019-2023_ENG_210x210_FINAL_290119_WEB.pdf,,,,,Action here is the Baltic Sea Challenge although the BSC participates in many different actions that target marine litter.,2020-01-31 12:44:13 UTC,2020-01-31 13:38:37 UTCFirst Phase,545728-545719-54578357,,YES,YES,YES,HELCOM - Baltic Marine Environment  Protection Commission,On behalf of an organisation,,HELCOM - Baltic Marine Environment  Protection Commission,"No, I am returning to the survey to report on additional actions/activities",,Principles for design reducing/ preventing marine litter,A list of principles to improve the different phases of the design process in terms of reduction/prevention of marine litter generation steamed from the HELCOM-INTERREG Workshop on Marine Litter and Ecodesign held on 15 June 2018 in Berlin (Germany) has been drafted.,"TECHNOLOGY and PROCESSES: New technical developments/innovation (e.g., research and development, new product design, new materials, processes etc.) changes in practice, operations, environmental management and planning.",,,,,,,,,,,New product design,,,,,,,,,,,,,,,,I/We are implementing it,,PUBLIC ADMINISTRATION (organisations concerned with government policies and programmes),,"International body,National ministry/agency",,,,,,Not applicable,,,,,No,,"Transnational (several countries are involved, including bilateral)",,"Denmark,Estonia,Finland,Germany,Latvia,Lithuania,Poland,Russian Federation,Sweden",,Other,The Baltic Sea,Design,,Reducing plastics,,"Human health and wellbeing,Biodiversity,Marine organisms,Ecosystem Services",,"Macroplastic (large, more than 20 mm, e.g. plastic bottles),Microplastics (tiny plastic particles less than 5 mm in diameter, e.g., found in personal care products/synthetic textiles)",,"Food packaging (containers, wrappers etc.),Non-food packaging (containers, wrappers etc.)",,Other,Secondary microplastics.,"Packaging,Transportation",,0,USD,0,USD,Not applicable,,Financial Rules of the Helsinki Commission can  be found here: https://helcom.fi/aboutus/  internalrules/  internal-rules/,Single event,,"HELCOM (2018) Principles for design reducing / preventing marine litter, document 4-5 to HELCOM PRESSURE 9-2018 https://portal.helcom.fi/meetings/PRESSURE%209-2018-548/MeetingDocuments/4-5%20Principles%20for%20design%20reducing_preventing%20marine%20litter.pdf Accessed 29 Jan 2020",,,,,,"A list of principles to improve the different phases of the design process in terms of reduction/prevention of marine litter generation steamed from the HELCOM-INTERREG Workshop on Marine Litter and Ecodesign held on 15 June 2018 in Berlin (Germany) has been drafted. Further work is envisaged to collect national information on national activities in the Baltic Sea aiming at establishing a dialogue and negotiate on solutions with business and industry to (i) develop design improvements that reduce the negative impacts of products entering the marine environment, and (ii) reduce over‐packaging and promote wise packaging.",2020-01-31 13:09:43 UTC,2020-01-31 13:40:48 UTCFirst Phase,545728-545719-54563789,,YES,YES,YES,"University of Montenegro, Institute of marine biology  ",As an individual,,,Yes,2,DeFishGear monitoring of marine litter in Montenegro,"monitoring, South Adriatic, beach litter, sea floor litter, floating litter, proposals of solutions for Government","MONITORING and ANALYSIS: Collecting evidence around plastic discharge to the ocean/waterways? (e.g. monitoring, analysis)",,,,,,,,,,,,,,,"Monitoring: On the seafloor,Monitoring: On the shoreline,Monitoring: In Biota,Review and synthesis :Environmental",,,,DEFISHGEAR,DEFISHGEAR,DEFISHGEAR,,It is freely available and open source,,https://www.researchgate.net/publication/310773310_Marine_Litter_Assessment_in_the_Adriatic_and_Ionian_Seas    https://www.defishgear.net/images/download/monitoring_surveys_/Review_Marine_Litter_Monitoring_in_the_Adriatic.pdf    https://www.sciencedirect.com/science/article/abs/pii/S0025326X18303138    https://www.sciencedirect.com/science/article/pii/S0308597X18301301    https://www.sciencedirect.com/science/article/abs/pii/S0025326X18304533,"LEGISLATION, STANDARDS, RULES: e.g. agreeing new or changing rules or standards that others should comply with, new regulation, agreements, policies, economic instruments etc. including voluntary commitments,WORKING WITH PEOPLE: Encouraging or enabling others (e.g., education, training, communication, awareness raising, behaviour change programmes),MONITORING and ANALYSIS: Collecting evidence around plastic discharge to the ocean/waterways? (e.g. monitoring, analysis)",I/We are implementing it,,Other,Implementation of the activities was carried out by several institutions from all Adriatic countries and Greece. It was part of the Eu funded project.,,,,,,,Not applicable,,,,,Yes,,Regional (UN Regions),,"Albania,Bosnia and Herzegovina,Croatia,Greece,Italy,Montenegro,Slovenia",,"Coastal zone,Maritime area within national jurisdiction",,Clean-up of plastic from the environment,,"Reducing plastics,Reusing plastic",,"Human health and wellbeing,Biodiversity,Marine organisms,Ecosystem Services,Food chain,Economics and Trade",,"Macroplastic (large, more than 20 mm, e.g. plastic bottles),Microplastics (tiny plastic particles less than 5 mm in diameter, e.g., found in personal care products/synthetic textiles)",,All of the above,,Other,Microplastics in biota and in water column,"Fisheries,Aquaculture",,5915178.571,USD,837053.5714,USD,Other,Eu funding,IPA CBC Adriatic,Continuous activity 1-3 Years,,http://www.defishgear.net/,,,,,,In the frame of DEFISHGEAR project it was worked on several different issues related to marine litter. It is impossible to put all information in this questionnaire. socio-economic dimension is one of the activities that should be taken into consideration as well as proposals for Government related to solutions.,2020-01-31 09:11:00 UTC,2020-01-31 13:55:09 UTCFirst Phase,545728-545719-54550409,,YES,YES,YES,Ministry of the Environment,On behalf of an organisation,,Fundacion Amiguitos del Oceano (NGO),Yes,2,Capacity-building ,"Our Education Programme is held on public schools at coastal communities in Ecuador. We try to rise ocean awareness thru audiovisuals (diving, marine life, marine litter), outdoors experiences (beach clean up and ecomurals), and participatory stories, encouraging kids to change plastic consumption habits, be more familiar to ocean issues, protect marine biodiversity, and be Ocean Heroes.","WORKING WITH PEOPLE: Encouraging or enabling others (e.g., education, training, communication, awareness raising, behaviour change programmes",,,"Awareness raising and Behaviour change,Education/Training,Other","Thru beach clean ups (picking up litter, classifying and making a top 5 per site), we try kids to see for themselves and realize what is polluting their community, and to get involved with solutions","Information campaign,Behaviour change campaign/programme,Community Engagement,Stakeholder Engagement,Citizen Science,Creative/arts event; exhibition",,"Other training programmes,Institutional development,Other","We are building our website (not available yet), and there will be available all kind of materials we use, so teacher can access for free and download information, videos or whatever they need to be used a resources for their environmental classes",,,,,,,,,,,,,,,,,,"LEGISLATION, STANDARDS, RULES: e.g. agreeing new or changing rules or standards that others should comply with, new regulation, agreements, policies, economic instruments etc. including voluntary commitments,WORKING WITH PEOPLE: Encouraging or enabling others (e.g., education, training, communication, awareness raising, behaviour change programmes),MONITORING and ANALYSIS: Collecting evidence around plastic discharge to the ocean/waterways? (e.g. monitoring, analysis)",I/We are implementing it,,"THIRD SECTOR (e.g. non-governmental and non-profit-making organisations, including charity groups, community groups etc).",,,,,,Non-governmental organisation,,Yes,Reporting is voluntary,,,,Yes,,Sub-national (it covers parts of one country),,Ecuador,,"Forests or Mangroves,Freshwater rivers and lakes,Urban environment,Waste disposal sites,Coastal zone,Maritime area within national jurisdiction,Open ocean and high seas",,"Use / consumption,Collection / sorting of plastics after use,Management of collected plastics,Clean-up of plastic from the environment",,"Reducing plastics,Reusing plastic,Recycling plastics",,"Human health and wellbeing,Biodiversity,Marine organisms,Ecosystem Services,Food chain",,"Macroplastic (large, more than 20 mm, e.g. plastic bottles),Microplastics (tiny plastic particles less than 5 mm in diameter, e.g., found in personal care products/synthetic textiles)",,"Bottles,Plastic bags,Food packaging (containers, wrappers etc.),Non-food packaging (containers, wrappers etc.),Smoking related litter (cigarette butts and packets),Fishing related items,Cups (e.g., disposable coffee cups),Plastic straws, stirrers, cutlery,Sewage-related items (this could include cotton bud sticks, feminine hygiene items and others disposed of via toilets),Natural disaster/hazard related debris,Polystyrene items",,Microplastics used in other products e.g. paints,,"Fisheries,Food & Beverages,Tourism,Wastewater/Sewage management",,45000,USD,1000,USD,"Crowdfunded,Voluntary donations,Private Sector",,"We have voluntary donations (people willing to donate, as also eco entrepreneurs who donate a voluntary percentage to our foundation)    We also organise events to rise funds such as ""salsa for the ocean"", and ""jazz for the ocean"", together with sponsors    We also collaborate with private companies based on SDG (SDG4, 12, 14, 15); making specific projects. So we work in house with the company, as we have budget for our educational programme (which has no cost for public schools in coastal areas)",Continuous activity 1-3 Years,,www.amiguitosdeloceano.com    ,www.instagram.com,https://www.youtube.com/watch?v=zLXoGCQakL8&t=20s,https://www.youtube.com/watch?v=RhsO3QiV_po,https://www.youtube.com/watch?v=WabbF8zrTac,https://www.youtube.com/watch?v=YbjhbiVL_TI,"We love our work! we love sharing our ocean love to our kids, we have so much fun with them. We truly believe that education is a great ally for conservation. Our propuse is to connect people to the ocean, so they can get to know him better, value him, and help him ",2020-01-30 21:25:47 UTC,2020-01-31 14:07:13 UTCFirst Phase,545728-545719-54580953,,YES,YES,YES,"University of Montenegro, Institute of marine biology",As an individual,,,"No, I am returning to the survey to report on additional actions/activities",,WELCOME project,"marine litter Adriatic, beach litter","MONITORING and ANALYSIS: Collecting evidence around plastic discharge to the ocean/waterways? (e.g. monitoring, analysis)",,,,,,,,,,,,,,,Monitoring: On the shoreline,,,,,DeFishGear Methodology for Monitoring Marine Litter on Beaches (macro-debris > 2.5 cm),,,It is not available,,,"MONITORING and ANALYSIS: Collecting evidence around plastic discharge to the ocean/waterways? (e.g. monitoring, analysis)",I/We are implementing it,,Other,"Implementation of activities are part of the partnership in the frame of EU funded project between Italy, Montenegro and Albania",,,,,,,Yes,Reporting is voluntary,,,,No,,Regional (UN Regions),,"Albania,Italy,Montenegro",,Coastal zone,,Clean-up of plastic from the environment,,Reusing plastic,,Biodiversity,,"Macroplastic (large, more than 20 mm, e.g. plastic bottles)",,All of the above,,,,All of the above,,1004464.286,USD,167410.7143,USD,,,EU funds,Continuous activity 1-3 Years,,https://www.italy-albania-montenegro.eu/welcome,,,,,,,2020-01-31 13:55:19 UTC,2020-01-31 14:10:04 UTCFirst Phase,545728-545719-54580117,,YES,YES,YES,HELCOM - Baltic Marine Environment  Protection Commission,On behalf of an organisation,,HELCOM - Baltic Marine Environment  Protection Commission,"No, I am returning to the survey to report on additional actions/activities",,Best practice on the disposal of old pleasure boats,"A report on the development of best practice on the disposal of old pleasure boats in the Baltic Sea is available, as well as information on activities and economic incentives aimed at appropriate disposal of End of Life Boats (ELB) including information from OSPAR and Barcelona Secretariats as well as activities at international level (e.g. IMO London Convention).","LEGISLATION, STANDARDS, RULES: e.g. agreeing new or changing rules or standards that others should comply with, new regulation, agreements, policies, economic instruments etc. including voluntary commitments.",Policy change or development,,,,,,,,,,,,,,,,,,,,,,,,,,I/We are implementing it,,PUBLIC ADMINISTRATION (organisations concerned with government policies and programmes),,"International body,National ministry/agency",,,,,,Yes,There is a mandatory reporting mechanism,,,,No,,"Transnational (several countries are involved, including bilateral)",,"Denmark,Estonia,Finland,Germany,Latvia,Lithuania,Poland,Russian Federation,Sweden",,Other,The Baltic Sea,Other,End of Life Boats (ELB),Other,Appropriate disposal of ELB,"Human health and wellbeing,Marine organisms",,Other,End of Life Boats (ELB) ,,,,,Other,Leisure boating,0,USD,0,USD,Not applicable,,Financial Rules of the Helsinki Commission can  be found here: https://helcom.fi/aboutus/  internalrules/  internal-rules/,Single event,,"HELCOM (2019) Development of best practice on the disposal of old pleasure boats, document 3-6 to PRESSURE 10-2019 https://portal.helcom.fi/meetings/PRESSURE%2010-2019-549/MeetingDocuments/3-6%20HELCOM%20RAP%20ML,%20RS1%20Development%20of%20best%20practice%20on%20the%20disposal%20of%20old%20pleasure%20boats.pdf Accessed 29 Jan 2020","HELCOM (2019) Compiled information on activities and economic incentives aimed at appropriate disposal of End of Life Boats, document 3-4 to PRESSURE 11-2019 https://portal.helcom.fi/meetings/PRESSURE%2011-2019-628/MeetingDocuments/3-4%20Compiled%20information%20on%20activities%20and%20economic%20incentives%20aimed%20at%20appropriate%20disposal%20of%20End%20of%20Life%20Boats.pdf Accessed 29 Jan 2020",,,,,"A report on the development of best practice on the disposal of old pleasure boats in the Baltic Sea is available, as well as information on activities and economic incentives aimed at appropriate disposal of End of Life Boats (ELB) including information from OSPAR and Barcelona Secretariats as well as activities at international level (e.g. IMO London Convention).   Further work is envisaged to develop a regional approach which would assist countries to handle the problem. Since the situation of ELB differs in the countries, the starting point to develop the regional approach would be a policy message based on the compiled material which, among other issues, identifies the roles of HELCOM, the EU and national governments in tackling the problem.",2020-01-31 13:41:38 UTC,2020-01-31 14:18:44 UTCFirst Phase,545728-545719-54582354,,YES,YES,YES,HELCOM - Baltic Marine Environment  Protection Commission,On behalf of an organisation,,MARELITT Baltic project,"No, I am returning to the survey to report on additional actions/activities",,MARELITT Baltic – Reducing the impact of marine litter in the form of derelict fishing gear in the Baltic Sea,"“MARELITT Baltic – Reducing the impact of marine litter in the form of derelict fishing gear in the Baltic Sea”, and Interreg funded project concluded in 2018. The work conducted during three years has produced among other outputs the so called ""Baltic Sea Blueprint“, a report containing policy recommendations on mapping of hot spots on DFG, their retrieval, the management of the retrieved FG as well as preventive measures.","TECHNOLOGY and PROCESSES: New technical developments/innovation (e.g., research and development, new product design, new materials, processes etc.) changes in practice, operations, environmental management and planning.",,,,,,,,,,,"Change in practice,Different environmental management of land based environments,Different environmental management of aquatic environments",,,,,,,,,,,,,,,,We are only reporting it here,,Other,MARELITT Baltic project,,,,,,,Yes,There is a mandatory reporting mechanism,,,,Other,"No, to the best of my knowledge","Transnational (several countries are involved, including bilateral)",,"Estonia,Germany,Poland,Sweden",,Other,The Baltic Sea,"Use / consumption,Collection / sorting of plastics after use,Management of collected plastics,Clean-up of plastic from the environment",,"Reducing plastics,Reusing plastic,Recycling plastics",,"Human health and wellbeing,Biodiversity,Marine organisms,Ecosystem Services",,Other,ALDFG,,,,,Fisheries,,4241071.429,USD,0,USD,Public Financing,,INTERREG BALTIC SEA REGION PROGRAMME 2014-2020. The Swedish partners particiapition have been co-financed by Swedish Agency for Marine and Water Management.,Other,Project,MARELITT Baltic (2019) The Baltic Sea Blue Print – A step-by-step roadmap on how to approach Derelict Fishing Gear https://static1.squarespace.com/static/58525fe86a4963931b99a5d1/t/5dd3e388c2af6160a093a55c/1574167495366/BSB.pdf  Accessed 29 Jan 2020,,,,,,"“MARELITT Baltic – Reducing the impact of marine litter in the form of derelict fishing gear in the Baltic Sea”, and Interreg funded project concluded in 2018. The work conducted during three years has produced among other outputs the so called ""Baltic Sea Blueprint“, a report containing policy recommendations on mapping of hot spots on DFG, their retrieval, the management of the retrieved FG as well as preventive measures.",2020-01-31 14:18:52 UTC,2020-01-31 14:42:51 UTC